text,date,time
The Pats and Soxs can bring their new trophies on play dates. ,2019-02-05,07:10
"Well my brethren, let's not forget, FUCK THE JETS",2019-02-06,10:33
&gt;Can you believe it??,2019-02-03,22:30
Curse reversed!,2019-02-04,00:23
The Great Drought of '19,2019-02-05,09:15
I wish I could hear Jerry's commentary during the game. He must have been losing it haha.,2019-02-03,22:32
The gift that keeps on giving ,2019-02-03,23:11
It was so hard boys. We almost ran out of food LETS GO,2019-02-04,00:02
Who cares? This has nothing to do with the RED SOX,2019-02-03,22:19
"Glad I’m not the only “love the Redsox, hate the patriots” guy. ",2019-02-04,11:37
Ugh. Just let me enjoy the Red Sox World Series victory without having to hear about Patriots ad nauseum. I come here to escape it. ,2019-02-04,10:07
"If only my parents had raised me to be a Patriots fan...   


My dad's family are Redskins fans from way back. I was one of the few Redskins fans in school growing up, but I think a lot of older people are Redskins fans because they used to play in Boston and that trickled down somewhat.   


Anyway, I grew up a Redskins fan. I didn't actually care about football until I was in about third grade so I never actually saw them be any good... I was a die hard Red Sox fan though and I have an on/off again Celtics fandom...   


I've been missing out. I wish I had some emotional connection to this amazing run the Patriots are on. ",2019-02-04,14:04
"Fuck the patriots, this is a sox sub. ",2019-02-03,22:45
The pats are the Yankees of the NFL.,2019-02-04,08:07
[Video](https://streamable.com/jmgrm),2018-10-08,23:14
"I’M SORRY, DID SOMEONE SAY DAMAGE?",2018-10-08,23:15
"Holy shit Brockoly's humility in the postgame interview is superb. ""Was that the first cycle in postseason really, really? I was wondering. **Let me go talk about how well OUR TEAM did**""",2018-10-08,23:27
[First postseason cycle ever!](https://twitter.com/alexspeier/status/1049498102984581120?s=19),2018-10-08,23:16
"Told my parents in like the 3rd inning that if he got a home run tonight, I’d get a Brock Holt tattoo. But then he hits a freakin’ CYCLE?!? I should just change my name to Brock Holt at this point. 

Seriously though, the tattoo is happening. Open to ideas because i’m not sure exactly what I’ll do yet!",2018-10-08,23:26
"A lot of frauds are going to come in here and act like they never gave up on him the past 2 years

This one was for the true believers",2018-10-08,23:18
That’s history folks. First cycle in over a hundred years of post season play. ,2018-10-08,23:17
THIS IS OFFICIALLY BROCKTOBER NOW,2018-10-08,23:20
\o/,2018-10-08,23:18
WHAT DO I DO WITH MY HANDS ,2018-10-08,23:18
"Brock Holt is now a trivia fact. Everybody who ever loves MLB facts is going to know the name Brock Holt.  I just can’t believe I was lucky enough to see history, even if only on tv.",2018-10-08,23:51
FIRST IN MLB HISTORY HOLY FUCK,2018-10-08,23:22
"Maybe next time when Cora fills out his lineup he'll remember

#ALWAYS HAVE YOUR BROCKOLY.",2018-10-08,23:25
FUCK THE YANKEES,2018-10-08,23:17
Holy shit. I have hated on Brock more than anyone I know. Like straight up trashed his name. I am so glad to look like a dumb asshole. ,2018-10-08,23:30
WELCOME. TO. BROCKTOBER.,2018-10-08,23:23
#I AM SO FUCKING HARD RIGHT NOW,2018-10-08,23:30
[mrw Brock Holt is the first person ever to hit for the postseason cycle ](https://imgur.com/a/ULxIDQJ),2018-10-08,23:56
Fucking unreal! That kid is never going to forget tonight!,2018-10-08,23:17
To hit for the cycle ever is amazing. To have that happen against the Yankees in the post season is epic. ,2018-10-09,01:01
I absolutely adore Brock.,2018-10-08,23:20
"if he isnt in the lineup for every game from now on, fire everybody",2018-10-08,23:22
It's a quiet night in the Bronx LOL,2018-10-08,23:26
DAMAGE,2018-10-08,23:15
#THATS A LOTTA DAMAGE,2018-10-08,23:53
BROCKTOBER IS HERE,2018-10-08,23:26
"Told two buddies in the 7th that if Holt hit for the cycle, I’d buy them each a six pack. Best $20 I’ve ever lost in a bet EVER",2018-10-08,23:36
It’s his second cycle!,2018-10-08,23:37
"Watching him run into the dugout after the homer was the greatest thing I’ve ever seen. Everyone was so excited, I fucking loved it! Fuck the Yankees! ",2018-10-08,23:40
Red Sox Legend as of tonight.  Might as well just indict him into the Red Sox HOF tonight.,2018-10-08,23:55
Brock Holt! \o/,2018-10-08,23:31
MY FUCKING MAN,2018-10-08,23:27
Amazing and hello historians! I’ve always believed in Brock and owned a copy of his last cycle’s baseball card in mlb bunt and own a brick shirsey ,2018-10-08,23:33
Brock is like a human golden retriever. The guy is so happy all the time,2018-10-09,00:31
Love watching history making moments! Holt is such a bad ass.,2018-10-08,23:19
Big Cock Brock taking over,2018-10-08,23:28
"This kid's fucking jacked. Thick, dense, built whatever you wanna call him he's got it. Legs thicker than my chest, and shoulders wider than my wingspan. Making full use of his frame and with the golden flow to top it off. He dwarfed us all. Bonafide stallion.",2018-10-09,00:10
"#IF YA SMEEELLLLLLL....

#...WHAT THE BROCK....

#...IS COOKIN’!",2018-10-09,05:48
MY DICK HARD,2018-10-09,07:04
"mookie doesn’t count cos obviously he’s everyone’s favorite. Brock Holt is my favorite player on this team. I’ve always thought he’s the heart and soul of this clubhouse, and as we saw tonight, his dong is absolutely massive",2018-10-08,23:45
"But.. but.. but.. he hit it to right field at Yankee stadium so that doesn't really..

..oh wait.

Edit: spelling",2018-10-09,08:04
Mr. October promos ran on XM last night for Reggie Jackson and all I can say is that Brock Holt just did something that you couldn't even do. 😄😃😂😁😅😆😉,2018-10-09,08:19
"I WANNA BROCK, BROCK! I WANT TOOOOOOOOOOOOOO BROCK (BROCK!) :D",2018-10-08,23:29
"My Dad and I sat next to his Mom and wife at a spring training game back in 2015. 

Nice family.",2018-10-08,23:36
"I just happened to catch this edit on Wikipedia before it got removed.  

"" On October 8, 2018, [Brock Holt](https://en.wikipedia.org/wiki/Brock_Holt) of the [Boston Red Sox](https://en.wikipedia.org/wiki/Boston_Red_Sox) was the first player to hit for the cycle in an MLB postseason game, in the [2018 American League Division Series](https://en.wikipedia.org/wiki/2018_American_League_Division_Series) against the New York Yankees, the worst team in baseball.""  

[https://en.wikipedia.org/w/index.php?title=Hitting\_for\_the\_cycle&amp;oldid=863167661](https://en.wikipedia.org/w/index.php?title=Hitting_for_the_cycle&amp;oldid=863167661)",2018-10-09,00:19
The best part was the home run off of backup catcher Austin Romine ,2018-10-09,00:30
“We WaNt BosToN” -Yankee Stadium,2018-10-08,23:56
I just hit the first post-season cycle yeah I'm feelin like a brockstar.  ♪  ,2018-10-08,23:57
Brocktober,2018-10-08,23:57
"All the way from southwest Louisiana, doesn’t matter to me one bit that it was off Romine. It was against the Yankees AND the first in Post Season History! DO DAMAGE!",2018-10-09,00:19
Brock has been amazing these last few weeks. He is really making the most of his limited play. Brockstar is now a legend! ,2018-10-09,02:09
The legend of Brock Holt continues!,2018-10-09,05:46
I often forget that this dude was our All Star during that relatively crappy season.,2018-10-09,08:49
Legendary!,2018-10-09,09:28
"HEY NOW, HE’S BROCKSTAR",2018-10-09,09:37
Brock Holt had 7 RBI last year....he had 5 RBI last night,2018-10-09,12:04
Can the Fenway fans give Austin Romine for helping Holt get the cycle? Like Yankees fans standing O to Price?,2018-10-09,12:17
Tony Maz is going to be so triggered. ,2018-10-09,14:08
BROCKSTAR!!! Fuck the Yankees!,2018-10-08,23:19
First time? Really? Wowsers!!,2018-10-08,23:23
"""Eat, sleep, hits for the cycle, repeat."" - Brock's agent, probably.",2018-10-08,23:33
"http://imgur.com/0PbHhbw
Salty Yankees fans right now",2018-10-08,23:39
HISTORY!,2018-10-08,23:44
Position players pitching directly into my veins ,2018-10-08,23:50
IT’S HIS SECOND CYCLE TOO,2018-10-08,23:56
why can I only upvote this once? ,2018-10-09,00:19
BROCKSTAR,2018-10-09,00:46
anyone have a video of the postgame interview?,2018-10-09,02:02
\o/,2018-10-09,02:53
"That's so much better than if he'd hit two doubles, a triple, and a homer! The cycle is such a significant milestone!",2018-10-08,23:52
#WOOOO!,2018-10-23,08:12
"Just walked by Fenway and got chills. Admittedly, this could be because it's cold and my jacket sucks, but I'm thinking it's the fact that we're in the fucking World Series.",2018-10-23,08:48
Chris Sale about to earn a new championship belly button ring,2018-10-23,09:39
I WAS JUST ABOUT TO MAKE A PRE-PRE-GAME THREAD BUT THIS WILL DO. WORDS CANNOT EXPRESS MY EXCITEMENT.,2018-10-23,08:13
"Do Damage to a 12-pack, amirite",2018-10-23,08:53
"I've already lied my way out of work too many times this Postseason, I am genuinely concerned for my well-being if this goes to game 7.",2018-10-23,08:47
"Wife and I are going, so obviously we're gonna win tonight. We've been to 7 games this year....Sox won all 7.

&amp;#x200B;

But more importantly, we were in the bleachers for Gm 6 in 2013.

&amp;#x200B;

&amp;#x200B;

\#DoDamage",2018-10-23,08:43
Fenway needs to make so much noise at Kershaw that the first 3 pitches he throws are balls and the 4th is a fastball str8 down the middle hit for a home run. Crush his spirits early. ,2018-10-23,08:42
"The final Pandora song of my commute this morning was Africa. Also, I work in Kenmore Square. Pretty perfect.",2018-10-23,09:31
I’M TELLING YOU IT IS TIME TO PARTY ,2018-10-23,10:07
BUENOS DÍAS MUCHACHOS !!,2018-10-23,09:30
# I AM WOKE AND I AM READY,2018-10-23,09:43
"Please beat the Dodgers.

That is all.",2018-10-23,10:01
"Tuning in from Toronto, FUCK YEAH RED SOX!",2018-10-23,09:16
[deleted],2018-10-23,09:52
This should be fun,2018-10-23,08:29
"I live in LA and I walked into a room at work yesterday filled with dodger fans, didn’t say one word, and felt like I got eaten alive. I can’t wait to step all over these fools tonight and respectfully not say a word tomorrow and know deep down that they feel like shit

EDIT: grammar ",2018-10-23,09:54
"LETS GO SOX, HERE COMES CHRISTOPHER ALLEN SALE TO FUCK SHIT UP GAME ONE",2018-10-23,10:01
[deleted],2018-10-23,10:02
I just want to win and for Dave Robert's to keep his job ,2018-10-23,11:03
We are winning this. ,2018-10-23,09:41
let's get it,2018-10-23,09:46
CAN I GET A FUCK MACHADO?,2018-10-23,11:18
"My butt is sore from how clenched it is already

Let's get us a championship, boys",2018-10-23,10:13
LET'S GO BABY,2018-10-23,08:42
LETS FUCKING GOOO!!! But why is pomeranz on the damn roster....,2018-10-23,11:23
I’m sitting at work in Manhattan and I am so tempted to buy a ticket on stub hub.  Take the hour train ride home. Then drive 3 hours to Massachusetts and take the T another 30 minutes from Riverside and FUCKING MAKE SOME NOISE FOR OUR BOYS,2018-10-23,13:09
Woot,2018-10-23,08:14
Woot woot. ,2018-10-23,08:15
I AM READY. MY BODY IS READY. LETS. GO. WIN. THE. FUCKING. WORLD. SERIES. ,2018-10-23,10:09
NERVOUSLY OPTIMISTIC ,2018-10-23,10:19
"Initiating Tactical Liver Strike in 9 hours and 27 minutes. The fridge is full of go juice, and the pre-apologies for behavior have been deployed to the wife! ",2018-10-23,10:42
"Sox fan living in L.A. The hate is real here. Radio stations and local channels are talking crazy shit about us. Calling us cheaters, saying Machado didnt do anything wrong... we have to win so we can shut them up. 

Fuck the West Coast Yankees!",2018-10-23,11:45
[deleted],2018-10-23,10:22
"TIME TO BLESS THE RAINS ON THE WORLD SERIES, FAM",2018-10-23,11:26
"I am not from Boston. What is the weather forecast? Cold, rain?",2018-10-23,12:23
"Hey Google what’s the weather forecast tonight in Boston, Africa?",2018-10-23,14:08
Shippin' Up to Boston on FUCKIN' REPEAT ALL DAY,2018-10-23,14:31
MY BODY IS READY LET'S FUCKIN GOOOOOOOOOOOOOO,2018-10-23,10:10
My do damage hoodie should be on my doorstep when I get out of work. I’ve waited a week but it felt like the whole season ,2018-10-23,10:19
I just dreamed we won it in game 7. Score was 9-9 in the 9th. Moreland hit a walk off 3 run homerun.,2018-10-23,10:34
"Midterms are this week for my college. I live in Michigan, so the majority of students here are rooting for the Sox to win it all. Of course my psychology prof is a Dodgers fan. ",2018-10-23,10:47
I am totally getting so much work done today!  Said no Red Sox fan ever.  ,2018-10-23,10:51
"I'm entering a raffle at work for Game 2 world series tix, wish me luck!",2018-10-23,10:56
Working at 5am really sucks this time of year. Hoping for a sweep so I don’t have to be dragging ass for too long. ,2018-10-23,11:19
LETS FUCKING GOOOOO! (best wishes all the way from Taiwan),2018-10-23,12:54
Trying not to think about it. Trying not to freak out. But....I’m freaking out guys. ,2018-10-23,14:06
I'm hoping the cold doesn't affect JD too much. I remember him being s bit stumpy early on and some blamed the cooler weather. ,2018-10-23,14:13
Let's go Red Sox!!! Rule 3!,2018-10-23,14:30
[let's do this!!!](https://www.myinstants.com/instant/instant-hype-button/),2018-10-23,09:38
"Go get em, boys! If my team is gonna lose, we're gonna lose to the future World Series Champions.",2018-10-23,14:44
I will be wearing the Mookie shersey for the 8th time this postseason today.  You can guess what happened the other 7 times.,2018-10-23,10:52
"[Red Sox you are the only, only, only] (https://music.youtube.com/watch?v=jR4tTQVjHUI&amp;feature=share)",2018-10-23,11:00
I’ll be representing down here in NJ gents. Busting out the Manny jersey for this one.  LETS GOOOO,2018-10-23,11:07
LETS FUCKING GOOOOO!!!!!,2018-10-23,11:07
RED SOX BRING DREW POMERANZ TO THE ROSTER CAUSE WE ONLY NEED 24 PLAYERS TO TAKE ON THE DODGERS LET'S GOOOOOOOOOOO,2018-10-23,11:44
"Rule 4, you freak bitches! Fuck the Dodgers!",2018-10-23,11:49
Gotta break the news that I will be an unproductive husk of a man for the next week at work. Sox in five. ,2018-10-23,12:22
Lets go Sox!!,2018-10-23,12:39
I’ve been in spain for the whole postseason. You best believe I’ll be watching the game which starts here at 2AM,2018-10-23,13:03
Damn these late start times. It’s hard being a teacher during the MLB playoffs.,2018-10-23,13:23
Is this for poppycock,2018-10-23,13:26
"There are a lot of people rooting for the Red Sox in Fort Myers, FL!!  My family included.",2018-10-23,13:32
BODY=READY,2018-10-23,13:37
"Checking in from Nebraska.

The good news is my evening grad school class got cancelled.

The bad news is I stayed home anyway because of a stomach bug. But I've got /u/enderandrew42 taking care of me and we're ready to watch the game! ",2018-10-23,13:56
Ordered my World Series hat right after we won last Thursday from MLB. Com. Anyone know how long it Usually takes to deliver. I live in Houston BTW. ,2018-10-23,14:07
FUCK YEAH LETS FUCKIN TAKE A TITLE HOME!!!!!!!,2018-10-23,14:29
SCREW THE DODGERS 😊,2018-10-23,15:14
Machado is the kind of guy to get ejected when he is hit by a pitch ,2018-10-23,15:19
"This Tweet just nails how I feel right now.

https://twitter.com/SurvivingGrady/status/1054796518698508288",2018-10-23,16:12
[GOOOOOOOOD MOOOOORRRRNIN VIETNAMMM](https://youtu.be/AwSra5p8MDw) ,2018-10-23,17:01
Please Boston. Please. I'm begging. Not the doyers. Kill them dead. 4 games. Killed dead. ,2018-10-23,18:03
Five years. Five years since we've been able to say that.,2018-10-23,10:45
"Prices are currently 800-ish for Game 4 in LA, odds that price goes down when Boston is up 3-0 or 2-1 by Friday?",2018-10-23,15:24
Can't wait! ,2018-10-23,15:28
"That’s cool, I guess.",2018-10-23,16:43
Pumped up and tuning in from SF !! ,2018-10-23,16:54
"I made my prediction for the series, but apparently a few people didn’t like the way it was worded. I took a screenshot and I will post it after game six.

GO SOX. BEAT L.A.

EDIT: In case I need to make it clearer, Boston in six. I’m going to go way out there and pick Bogaerts for Series MVP. Not sure why, but I just have a feeling he’s gonna be the one to make shit happen.",2018-10-23,16:56
Red Sox bring that muthafuckin ruckus!!!!,2018-10-23,20:07
That's one,2018-10-23,20:14
Checking in from Los Angeles. Ready to throw it down for the Sox in enemy territory. LET'S GOOOOOOOOOO!!!!!,2018-10-23,15:13
[deleted],2018-10-23,08:31
Dodgers in 4! Easy work!,2018-10-23,09:56
"https://i.imgur.com/HkSY1Z1.jpg

https://www.youtube.com/watch?v=SiUoBPO3gTU",2020-10-17,23:52
2004 ALCS VICTORY PARTY!!!!! RED SOX STILL THE ONLY TEAM IN MLB HISTORY TO COME BACK 3-0 TO WIN A SERIES :D,2020-10-17,23:55
"Thank god. I wanted the Rays to win on three reasons. 1 so they can avoid being with the Yankees with 3-0, 2, I wanted the Astros to lose. 3, Boston and Tampa can beat Houston in the ALCS but New York can’t. 

Fuck the Astros and Fuck the Yankees!",2020-10-17,23:57
"Fuck the Yankees, but also fuck the Asterisks",2020-10-17,23:53
"Time to watch ""Four Days In October"" again to remind myself that we're the best.",2020-10-17,23:59
[deleted],2020-10-18,00:05
Imagine not coming back from 0-3 LUL,2020-10-18,00:02
Yankees stand alone in Chokeville!,2020-10-17,23:56
"Had a roommate at the time who was a HUGE Yankees fan. Spent the first three games rubbing it in my face. After that playoff series ended, I spraypainted, ""Biggest choke in history,"" on the roommate's door.",2020-10-18,00:21
Thank the baseball gods. The Astros don't deserve the magic of coming back from 3-0.,2020-10-18,00:08
Fuck yeah,2020-10-18,00:02
I'd say most Yankees fans are perfectly fine with retaining this honor. Fuck the Astros,2020-10-18,00:00
The Lakers already tied the Celtics for banners this year. The Astros sharing the comeback record would’ve been unbearable.,2020-10-18,01:06
A double win. We keep our wonderful comeback in-tact and cheaters were eliminated. What a glorious day.,2020-10-18,02:39
Thank Christ.,2020-10-18,00:32
Can't upvote this hard enough. Hell yeah,2020-10-18,00:38
Too bad they didn't get to do that farce of a ceremony in front of their fans. The stadium might have been as much as halfway full.,2020-10-18,00:14
even better that the Astros made it to 3-3 then choked in game 7!,2020-10-18,01:29
"Love to see it, those comparisons were absurd",2020-10-18,00:15
FUCK YOU HOUSTON AND YANKEES SUCK,2020-10-18,00:18
Eternally happy that the Astros are not in the WS again this year,2020-10-18,01:09
"Thank you Dave Roberts and the rest of the Idiots! We’re all cheering for the Dodgers to win it all this year, right?",2020-10-18,08:19
We are so delightfully petty. Go Sox!,2020-10-18,14:11
There can only be one comeback,2020-10-18,00:43
Do you still have that Red Sox discord server?,2020-10-18,01:32
Love to see it.,2020-10-18,02:47
Best news I've heard all year .ayyy DA JANKEES LOSE,2020-10-18,04:47
Boo-Yah...,2020-10-18,12:38
Again,2020-10-18,17:16
4001 days since the Yankees won the world series!!,2020-10-18,18:22
Lmao.,2020-10-18,21:03
Kudos and high fives all around.,2018-08-06,00:53
"""slaps ass"" ",2018-08-06,00:54
I don’t think so. I’m pretty sure Alex Cora is a mod on this sub,2018-08-06,01:06
I got to say I'm pretty proud the New York Yankees are a good professional baseball team right?,2018-08-06,01:08
Let the shitposting begin lol,2018-08-06,01:02
The reason we’re trying so hard to beat them is so that they won’t get 69 wins,2018-08-06,01:19
"The real treat is they are only 2.5 games (I think) over Oakland for the wild card. And Seattle is lurking too.

Technical question - if the Astros win the West, the Athletics and Mariners could still take the two wild card spots right if the Yanks keep losing? ",2018-08-06,09:08
Just a reminder: Giancarlo Stanton has Chola eyebrows,2018-08-06,01:03
"Tonight was beyond amazing

I was watching it with my father who is on the older side with MS (multiple sclerosis), and at one point I realized he had nodded off. At the bottom of the ninth I decided to wake him up because I just had a good feeling, and it was the right call! He was so thrilled to watch them win and it really made me happy to see him so happy.

One of these days I'd love to take him to Fenway (I don't think he's gone in a loooong time) but it'll have to be an afternoon game!",2018-08-06,03:23
F,2018-08-06,01:06
"Boone is a terrible manager, his guys don't play hard for him, he left his guy out there on the mound the other day to get murdered and embarrassed- he is nothing more then a yes man to Cashman... Every man on the Red Sox roster plays his balls off for Cora, they respect him, they respect each other and they are an absolute wagon who can beat anybody anytime anywhere. ",2018-08-06,07:57
Yes!!! ,2018-08-06,00:54
Aww yis finally made it bois!,2018-08-06,00:58
We all did the same damage as they did,2018-08-06,01:14
You can't be half-steppin' with that mediocre cheese!,2018-08-06,11:52
rule 3,2018-08-06,01:20
"Same number as the Jets, too",2018-08-06,02:01
[Did someone say high fives?](https://i.pinimg.com/originals/a4/c7/58/a4c75869d223aa90129ab6c89646ac34.gif) ,2018-08-06,07:03
"That is just ***cold.***

I love it!",2018-08-06,01:15
"My best friend got married this weekend. I asked him, best man to groom, to get married every time the Sox play the Yankees. 


He said he'd think about it",2018-08-06,12:38
"It's so funny too because the Yankees fans were already talking about how they have 18 home, 11 away this month. The *only* team they play above .500 is the Rays (currently *at* .500) and they have a superbly **EASY** schedule, especially this late in the season. It's not unfathomable that they start closing that gap a bit, because they're playing teams with records in the .300s. Amazed that's even a thing!",2018-08-06,13:23
4 day weekend too 💁🏻‍♂️,2018-08-06,01:01
The Yankees have an indefinite stay in the bathroom,2018-08-06,01:59
*this month,2018-08-06,09:07
Big if true,2018-08-06,09:44
Not to mention the weekend was one of those long ones that started on Thursday night!,2018-08-06,11:17
Thoughts and prayers to the Yankees,2018-08-06,11:30
/u/brockstar4life is out here somewhere just chuckling,2018-08-06,12:57
"Nobody check this. Just trust me

✂✂ Snip snip motherfuckers ✂✂",2017-09-20,22:18
Well played. Quality shitpost.,2017-09-20,22:19
"Lmao, that's good",2017-09-20,22:19
"For those curious, [Judge is actually at 198 strikeouts](https://www.baseball-reference.com/players/j/judgeaa01.shtml#content) at the time of this comment.",2017-09-20,23:17
I see wht you did there..,2017-09-20,22:20
"As a White Sox fan, this is bittersweet. Happy for you guys but wish he had gotten this for us! Go Sale!",2017-09-20,22:41
"Very nice. I'm not sure, but I think Judge is about 22, 23 from the season record, I'm pretty sure he can do that in about 6 games.",2017-09-20,22:53
Lmfao,2017-09-20,22:22
Fucking hilarious. Quality.,2017-09-20,23:10
Brutal.,2017-09-20,22:23
"""Records were made to be broken"" - Mark Reynolds",2017-09-21,00:16
Ruthless,2017-09-20,23:23
Randy Johnson has the most porn sounding name ever....,2017-09-21,06:45
Lmao!,2017-09-20,23:56
What a shitpost ,2017-09-21,00:04
"Ha ha, made me laugh, love it",2017-09-21,01:16
Savage ,2017-09-21,07:06
"D A N K

A

N

K",2017-09-21,09:13
Didn't Pedro get his in 1999?,2017-09-21,10:15
does this really have ~1000 points or am I going crazy ,2017-09-21,13:21
Curt Schilling is an idiot.,2017-09-21,16:14
[removed],2017-09-21,00:00
"HOUSTON (AP) -- Researchers in Houston today announced a shocking discovery that has upended the scientific world. They say they have collected conclusive evidence that 13-year old Rafael Devers is the biological father of 36-year old Justin Verlander.

""This discovery upends everything we know about not only human biology but also the linear nature of time,"" said Solo Johnson, one of the researchers on the team that announced the discovery. ""But the data we have collected allows for no other conclusion.""

Researchers say they first became suspicious of Verlander's true paternity in October 2018 when Devers ""totally dad dicked"" Verlander in the ALCS. But their sample size at the time was too small to pass scientific muster.

Now they report further testing has confirmed their prior findings.

""After observing the young third baseman again assert his fatherly dominance at Verlander's own park, we can now say with 100 percent scientific certainty that Rafael Devers is Justin Verlander's biological father.""

Although earlier findings drew skeptics from across the scientific community, the researchers' latest findings have produced wide-spread consensus.

""At first I said, 'Are you kidding me?'"" recounted Stat Masterson, chair of the Bridgepiece Studies Department at the Massachusetts Institute of Technology. ""But now it's a beautiful thing. I'm telling ya.""

Scientists from around the world report that they expect another opportunity to observe the unusual father-son duo in their natural habitat this fall.",2019-05-26,18:36
You fucker hahaha I started reading like what in the blue hell is this. Then I saw the redsox page hahaha good one,2019-05-26,18:42
Top tier shit post,2019-05-26,18:58
This is a shitpost but it's literally of the highest quality.,2019-05-26,19:03
WTH I got a notification on my phone like it was actual breaking news. This is one of the best shitposts  I ever seen.,2019-05-26,19:23
"&gt; 92% upvoted

I'm very disappointed in 8% of you.",2019-05-26,19:15
"This needs to make its way onto the State of the subreddit post this week, so the rest of r/baseball is jealous of our god-tier shitposting!",2019-05-26,23:28
That sucks. Devers is gonna get suspended for child abuse now,2019-05-26,19:54
Shitposting of the year,2019-05-26,21:54
This is incredible.,2019-05-26,19:16
