text,time_of_post,game,team
"While I have a slight distaste for the Red Sox, I fucking hate cheaters. Go Braves.",2021-10-23,[],TB
Good. Fuck 'em,2021-10-23,[],TB
"Cheaters vs Cheaters so whatever

Now LETS GO BRAVES",2021-10-23,[],TB
"I get that we hate the Red Sox, but I don’t think I’ll feel good about the Astros winning a baseball game for at least another decade",2021-10-23,[],TB
Cool but fuck the fuckin Astros.,2021-10-23,[],TB
"Literally hot for 7 games and then their true form shows. It should have been us in the CS but alas that’s playoff baseball

Glad that fraud of a team didn’t make it though",2021-10-23,[],TB
Fuck you Boston. Have a slice of fuck you pie.,2021-10-23,[],TB
I like how Sox fans are saying that Houston cheated even though they used Apple Watches to do the same,2021-10-23,[],TB
[deleted],2021-10-23,[],TB
🕯,2021-10-23,[],TB
Sweet was it a plague or a nuke? Always hated that city,2021-10-23,[],TB
Now that the Sox are gone maybe I can watch a game now.,2021-10-23,[],TB
I'm happy for Todd Kalas,2021-10-23,[],TB
Excellent. Fuck bahstann and fuck Stu.,2021-10-23,[],TB
This sub is the biggest cry sub in mlb history,2021-10-23,[],TB
You boys fuckin salty,2021-10-23,[],TB
what a lame petty post,2021-10-23,[],TB
This thread is so full of salt it's like I'm in Don Juan Pond.  And it's delicious.,2021-10-23,[],TB
Ji-Man Choi! Ji-Man Choi!,2019-10-08,['401169087'],TB
As a brewer fan... I WANT HIM BACK,2019-10-09,[],TB
Can we get a Choi Boy flair?,2019-10-09,[],TB
Banana Man!!,2019-10-09,[],TB
Choi boy flair!!,2019-10-09,[],TB
Flappy Choi!,2019-10-09,[],TB
s/o to the flappyboys who were there chanting!!!,2019-10-09,[],TB
"2019 Gold Glove Awards on ESPN just announced KK as the winner among him, Mike Trout, and Jackie Bradley Jr.

Was there any doubt? #RaysUp",2019-11-03,[],TB
Atta boy Ks,2019-11-03,[],TB
"They say 75% of the earth is covered by water, the rest is covered by Kiermaier",2019-11-04,[],TB
Woooooo!,2019-11-03,[],TB
Baseball gods smiling on KK tonight.,2019-11-03,[],TB
Well there’s a positive. The Bucs and Lightning are making me feel like shit rn,2019-11-04,[],TB
Outlaw strikes again,2019-11-03,[],TB
Well deserved.,2019-11-04,[],TB
"Just wanted to congratulate us on making the postseason, really rooting for us the rest of the way. 

Cheers",2019-10-01,[],TB
I’m with you man. I usually turn the Rays game on if the Rays aren’t playing. I gotta say I really love watching your team. Really pulling for you guys.,2019-10-01,[],TB
“I come in peace”,2019-10-01,[],TB
Cheers! Hope your team does well too!,2019-10-01,[],TB
Thanks man—good luck to your team next season.,2019-10-01,[],TB
Get out. We don’t want your kind in this sub. It’s for Rays fans only. Rays fans are not welcome.,2019-10-01,[],TB
Obviously Id love to see us go all the way but honestly even if we just beat oakland and loose in the quarters ill still be super proud of this team. i know by now its become a little overused as an argument and defensive statement but we have of the lowest payroll in all of MLB and yet still made made it this far when competing against teams like the Yanks and the Astros with well over double the budget. Thats damn impressive and an underdog story to root for.,2019-10-01,[],TB
"Also a Rays fan here coming in piece. I agree with OP, wishing you guys luck this postseason and in future seasons.",2019-10-01,[],TB
Thanks man. Appreciate the support!,2019-10-01,[],TB
A's fan here. Congrats on making the postseason! If you beat us then I'm cheering for you guys 100% of the way.,2019-10-01,[],TB
,2021-05-21,['401227723'],TB
"He was a great guy and clubhouse personality for sure. I remember when him and Jake Bauers came up, thought they were going to be the future. But this FO know what they’re doing. We’re all on Franco watch now!",2021-05-21,['401227723'],TB
"But he just became Homer Willy...Trevor Richards gone too. Cash wanting to beef up the bullpen with all the injuries.

Choi must be weeping. Who's gonna lift his helmet off now when he comes in after a dinger?",2021-05-21,['401227723'],TB
"Good luck with the Brewers, Willy!",2021-05-21,['401227723'],TB
Holy shit just am I hearing this right.  Dam just dosent feel right,2021-05-21,['401227723'],TB
"Yeah, same. Love his personality and his defense, but I won't miss his Bat.",2021-05-21,['401227723'],TB
"Willy was my favorite player. We went to a game in Minnesota and sat in the front row just past 3B. Willy caught a pop up to end an inning, saw me in my Rays shirt and motioned to me to walk over a section towards the dugout, he reached around the protective netting and gave me the ball. Minny fans booed that he gave me the ball. He went out of his way to give it to a Rays fan.",2021-05-21,['401227723'],TB
"He was my favorite Ray :(, but I trust the team and the moves they make by now",2021-05-21,['401227723'],TB
So much love and appreciation to Willy. He was just so much fun to watch on and off the field. We'll miss him representing the Rays.,2021-05-21,['401227723'],TB
"Loved Willie’s passion and energy. But it wasn’t happening for him on the field this year. Hope the best for him in Milwaukee. 
I know everyone wants Wander up but keep in mind he has less than 20 games above A ball. And he’s also on a cold streak at the plate right now. Don’t want to throw him in the fire just yet. 

Walls deserves a call up. Fantastic defender and a disciplined switch hitter. He’s our no.7 prospect so get excited!",2021-05-21,['401227723'],TB
"I have a feeling Willy's bat is going to improve dramatically. For whatever reason, he unfortunately could never hit in the Trop and had the craziest home/road split I have maybe ever seen. Really rooting for him to because the complete offensive/defensive player I think he can be.",2021-05-21,['401227723'],TB
"He was my favorite, by far. He had been slowly improving.... little by little each year, he was stepping up. I could really see him becoming a clubhouse leader. He was the heart &amp; soul of this team and I am just heartbroken 😞

I can’t imagine he is very happy about this either. God dammit Willy!! Thanks for the memories.",2021-05-21,['401227723'],TB
"Gonna miss Willy, hope he goes to MIL and goes Road Willy full time.  ¡Buena suerte!",2021-05-21,['401227723'],TB
Big picture are we actually going to miss him that much? Wander probably getting called up soon,2021-05-21,['401227723'],TB
Thinking Taylor Walls or Brujan get the call since they are on the 40man and Wander is not,2021-05-21,['401227723'],TB
I wonder how the tik tok user I follow is doing right now. She was madly in love with Willy.,2021-05-21,['401227723'],TB
"Man what the fuck. Fuck. Should have seen this coming just hope they would’ve been able to justify paying him just for his clubhouse boost
I feel like the morale boost justifies his contract",2021-05-21,['401227723'],TB
"Man that sucks. I love Willy. His energy during the Series last year was just fucking unmatched. 

Hope the Brewers fans appreciate him like we did.",2021-05-22,['401227738'],TB
I’ll always be a fan. There have been some super fun moments with Willy on this team and I wish him nothing but the best moving forward. That dude seems like he’s so fun to be around.,2021-05-21,['401227723'],TB
Damn.  I think his bobble head night was supposed to be June 9th against the Nationals.  Rays already took it off their website.,2021-05-21,['401227723'],TB
I've come to trust in the FO...but sometimes it's just damn...,2021-05-21,['401227723'],TB
Same. However he was just the odd man out unfortunately. He’s a big piece of the Rays era we have now,2021-05-21,['401227723'],TB
"Always played hard, seemed like. But while the couple of kids on the way up might or might not pan out, Adames has probably hit his ceiling.",2021-05-21,['401227723'],TB
"Ugh, Willy was my favorite Ray. I loved his energy, so much love and positivity from him always. I had a feeling it was coming but I wasn’t ready, I’m sad.",2021-05-22,['401227738'],TB
"This one hurt, but it was inevitable. As much as I loved his energy, he just wasn't producing and we have infielders coming up. The only one that is gonna hurt more is when its Joey Baseball's time to move on.",2021-05-23,['401227753'],TB
Really gonna miss Willy's energy and vibe in the clubhouse. Hope he has a great career and can't wait to see him back in the Trop again. I also think his bat will improve overall not having to play in the Trop regularly (sadly),2021-05-21,['401227723'],TB
"where were you when adames trade

i was at touch tank when neander call

""willy is trade"" 

""no""",2021-05-21,['401227723'],TB
Fuck. I’m gonna miss him,2021-05-21,['401227723'],TB
"Dude saaame man. I know our infield has been loaded for quite a while and we gotta make room for Franco, but Willy had been growing on me for quite a while and I'm pretty bummed we won't be keeping him around for a while.

Also, I ordered a powder blue Adames jersey just a couple of weeks ago, and haven't even gotten it in yet. FUCK.",2021-05-21,['401227723'],TB
,2021-06-12,['401228004'],TB
And the Bolts are about to lay the smackdown on the Islanders in 12 hours. Were just blessed as fans of all the teams in this beautiful bay.,2021-06-13,['401228019'],TB
[deleted],2021-06-13,['401228019'],TB
Life is good!,2021-06-13,['401228019'],TB
From 19-19 to 30-19. History in the making.,2021-05-24,['401227761'],TB
BRING ME THE DODGERS,2021-05-24,['401227761'],TB
Yo congrats. I’m very exited to see the boys in August for my first time at Fenway,2021-05-24,['401227761'],TB
Happy for the flappy bois!,2021-05-24,['401227761'],TB
[deleted],2021-05-25,['401227768'],TB
"The Rays are hungry, they're coming for that championship and they won't be denied.",2021-05-25,['401227768'],TB
Tied (with Boston) for the lead in runs scored with 249. Houston right behind at 248. When was the last time we could say the Rays are leading the league in runs scored?,2021-05-25,['401227768'],TB
" Hello and welcome to the Rays subreddit, I am your friendly /r/TampaBayRays Moderator and heart-throb /u/RyeWhiskeyy. Allow me to be your guide on the epic journey that is Rays Baseball.

As some of you may or may not have known, The Rays have been playing professional baseball since the late 1900's. They are Located in St. Petersburg Fla, ( I know, I know, But St.Pete is in the Tampa Bay Area, so close enough, right?) a historic baseball community. They are owned by Stu Sternberg, a Wall street investor. Leading the front office are Matt Silverman and Eric Neander. With Coach Kevin Cash managing on the field.


For a guide to the previous 2018 season [read my toast from Toast from the baseball subreddit](https://old.reddit.com/r/baseball/comments/al9yzo/a_toast_to_the_tampa_bay_rays/?) /r/Baseball, That is also a great sub if you haven't already.

Have a look at our [roster](http://m.rays.mlb.com/roster/) and familiarize yourself with some of our team. Some sub favorites are Tommy Pham, ji-Man Choi, Tyler Glasnow, Austin Meadows and Brandon Lower.

Now baseball is a game played between two teams of 9 players, When the offensive team comes up to bat, They have 3 chances or "" Outs"" to move players on to base and down the baseline.  They can reach base by getting a hit, getting walked ( When a pitcher throws 4 garbage pitches that the hitter doesn't swing at also known as ""Balls"") getting hit by a pitch, balk and there are a few others I guess but these are the important ones. Each individual batter can swing at the ball until they have either accumulated 3 swings that did not hit anything called "" strikes""or 4 balls, as we previously discussed. At this point, they are either get a hit, are out or take 1st base. Each team gets three outs per inning, and there are 9 innings, so be prepared to watch a game for at a minimum of at least 5 or 6 hours.

Now the defenses job is to Pitch the ball , that guys job is to throw nasty pitches, in the strike zone, or Umpires zone of bullshit, to strike out the other team. If the ball is hit into play, Its up to the fielders to field the ball and assist with getting the out by either catching the ball or throwing the ball to whatever base a offensive player is running too. Multiple outs can be gotten in a single play.

Anyways, that's enough explaining baseball to you, I know it seems complicated, but its not and you will understand it soon enough.  

Now the Rays play at a historic field named for a wonderful juice brand called Tropicana. You Lightning fans may know it as it was once home your hockey team. Well, a lot has changed since then and I can guarantee that there probably isn't any ice on the field anymore. Now, a lot of people like to talk shit about the Trop, They say its ugly and disgrace to baseball, so In that instance Rule number 1 is always Defend the Trop, I don't care if you hate it, It's ours and you are going to fucking like it. If any silly Yankees fan talks shit about the Trop and brags about the 27 rings their team won 2,000 years ago, tell them to shove it. Literally shove the Trop up there ass, Its spherical so it shouldn't be to hard.

So why should you bandwagon the Rays and not some other loser ass team? Well, The Rays are simply different. If you didn't know, The Rays have one of the lowest payrolls in baseball, they rely on atypical strategies like Openers, bullpenning, defensive shifts etc that baseball traditionalist hate. But fuck them. Not only are the Rays not afraid to try new things, but they are also fairly successful at it. After using these strategies to take a team predicted to win 60-ish games to competing for wild card spot, many people are looking at baseball differently as the Rays are at the forefront of baseball innovation. Gone are the days or peanuts and crackerjacks and getting sucked off underneath the right field bleachers. Today is about pulled pork nachos, petting stingrays in left field and Blake Snell streaming fortnite for some reason. You guys are privileged to  watch history in the making and by privileged I mean getting to watch Ryne Stanek (Crack Thor) get 30 game starts with only 50 innings pitched. 

I hope by now you guys have realized this post is a joke, so welcome to the subreddit and please don't forget to join our discord https://discord.gg/fNKTfgj and as always, Defend the Trop. I swear to god you need to physically threaten people if they talk shit about the Trop.",2019-04-17,['401074991'],TB
"You mentioned a balk, but didn't explain what it is. Which can be frustrating to new fans because it's not very self-evident, so I figured I'd post the official balk rules for people new to baseball.

# Balk Rules

1. You can't just be up there and just doin' a balk like that.

1a. A balk is when you

1b. Okay well listen. A balk is when you balk the

1c. Let me start over

1c-a. The pitcher is not allowed to do a motion to the, uh, batter, that prohibits the batter from doing, you know, just trying to hit the ball. You can't do that.

1c-b. Once the pitcher is in the stretch, he can't be over here and say to the runner, like, ""I'm gonna get ya! I'm gonna tag you out! You better watch your butt!"" and then just be like he didn't even do that.

1c-b(1). Like, if you're about to pitch and then don't pitch, you have to still pitch. You cannot not pitch. Does that make any sense?

1c-b(2). You gotta be, throwing motion of the ball, and then, until you just throw it.

1c-b(2)-a. Okay, well, you can have the ball up here, like this, but then there's the balk you gotta think about.

1c-b(2)-b. Fairuza Balk hasn't been in any movies in forever. I hope she wasn't typecast as that racist lady in American History X.

1c-b(2)-b(i). Oh wait, she was in The Waterboy too! That would be even worse.

1c-b(2)-b(ii). ""get in mah bellah"" -- Adam Water, ""The Waterboy."" Haha, classic...

1c-b(3). Okay seriously though. A balk is when the pitcher makes a movement that, as determined by, when you do a move involving the baseball and field of

2) Do not do a balk please.",2019-04-17,['401074991'],TB
The Rays are number one in the league right now? *twitches*,2019-04-17,['401074991'],TB
"I come brokenhearted, shocked, stunned, empty and defeated from r/TampaBayLightning.

With that said! #RaysUp!!",2019-04-17,['401074991'],TB
"Zappy parts flaccid, but my flappy parts are good to go.

Credit to:",2019-04-17,['401074991'],TB
ka chow,2019-04-17,['401074991'],TB
couldn't have said it better myself,2019-04-17,['401074991'],TB
"Rays are looking great...but are they just setting up the fan base to be lightning’ed?????  Surely can’t happen twice, right?",2019-04-17,['401074991'],TB
"""Since the late 1900's"" perfect",2019-04-17,['401074991'],TB
Thank you I’m all in now,2019-04-17,['401074991'],TB
"This is hilarious. Good job!


30 game starts with only 50 innings pitched 😂",2019-04-17,['401074991'],TB
"Big protip for the bandwagon: don't actively watch every game.  Put it on for background noise or casually glance at the box score.  We have 139 games to go (as of the instant I posted this) before we even enter playoff season, you will almost certainly burn yourself out if you are try to watch every minute of every game.

I personally watch a full game on Friday or Saturday, and background noise the rest while shitposting here.",2019-04-23,['401075070'],TB
"Hey flappy boys!

I'll be in town and want to catch the Red Sox/ Rays game on Saturday (i know, Red Sox big market team, saturday night)

Whats the cheapest I could realistically get them for? I'm fine with Nose Bleeds I've just always wanted to see a Rays Game at the Trop.",2019-04-18,['401075004'],TB
We all about the Rays now. We've always been about the Rays. It's ride or die in the Bay.,2019-05-01,"['401129794', '401075186']",TB
"excellent write-up, sir 🙌🏼",2019-05-09,[],TB
Will you accept a jaded Marlins fan?,2019-05-31,['401075583'],TB
THIS WAS FUCKING HILARIOUS!  I needed this! 😂😂😂😢,2019-04-17,['401074991'],TB
Well now I'll never get the full baseball experience of getting sucked off under the right field bleachers.,2019-04-19,['401075016'],TB
LMAOO games are not 5-6 hours. They’re usually 2.5,2019-04-19,['401075016'],TB
"Late 1900’s, don’t you mean late 1990’s?",2019-04-20,['401075031'],TB
"Bleh, grew up in Central Florida. Crime Dog and Wade Boggs, hero's. Like absolute Shaq when I was a kid, I hate you all, I'm old.",2019-05-05,[],TB
can you unpin this shit??  so tired of seeing the Lightning thing,2019-06-08,"['401075695', '401129333']",TB
[deleted],2019-04-17,['401074991'],TB
