text,time_of_post,game,team
Very well deserved. Where would this team be without him?,2020-11-10,[],TB
Well-deserved. This one was a long time coming.,2020-11-10,[],TB
Cash is King baby. Fuck the haters.,2020-11-10,[],TB
Before some moron hater jumps into these comments: this is a regular season award.,2020-11-10,[],TB
I like him in that he is one of the few managers to fully embrace analytics. Great manager we probably don’t appreciate him enough.,2020-11-10,[],TB
" with our payroll and the hitting we have, to take us to 6 games in the WS is astonishing. Well deserved.",2020-11-10,[],TB
"Very well deserved! Florida teams swept manager of the year, too",2020-11-10,[],TB
My king,2020-11-10,[],TB
Hell yeah!,2020-11-10,[],TB
LETS FUCKING GO,2020-11-10,[],TB
After two weeks of everyone bitching about pulling snell and ruining baseball he’s manager of the year.  I love it,2020-11-10,[],TB
"All of baseball social media calling Cash a joke rn

Baseball fans are kinda annoying, most dont really watch or pay attention to the regular season, and everything is about the postseason for them",2020-11-10,[],TB
Was going to say congrats but he pulled my comment too early,2020-11-10,[],TB
best manager in the league,2020-11-10,[],TB
Game 7.,2020-11-10,[],TB
Here before cash haters,2020-11-10,[],TB
FLAP FLAP BABY,2020-11-10,[],TB
💰💲💵💸🤑,2020-11-10,[],TB
Well earned,2020-11-10,[],TB
"Very well deserved, should have gotten it last year. It's a shame that history will remember him for that one mistake.",2020-11-11,[],TB
You love to see it.,2020-11-11,[],TB
we would be putting the banner up next year,2020-11-11,[],TB
"Came here to see someone freaking out about how Cash pulled Snell. Regardless how you feel about that decision, he is no doubt a hell of a coach. Congrats to him.",2020-11-11,[],TB
Hahahhahaaaaaa!  This is the best timeline,2020-11-10,[],TB
Really? Nice.,2020-11-11,[],TB
"Oh, and we're still on pace for a 100-win season.",2021-06-11,['401227990'],TB
I’ve seen this one before,2021-06-11,['401227990'],TB
I love this poverty franchise.,2021-06-11,['401227990'],TB
Local ray goes brrrrrrt,2021-06-11,['401227990'],TB
already tied last year W's and it's only June!!!,2021-06-11,['401227990'],TB
Love seeing my Rays on top but its even more surprising to see Boston hanging around for this long. I hate Boston more than anybody but damn do they have a sneaky good team for only being 1 game back from us.,2021-06-11,['401227990'],TB
Let's go Rays!,2021-06-11,['401227990'],TB
Undefeated in the Rays in the tank era,2021-06-12,['401228004'],TB
LETS GO!,2021-06-11,['401227990'],TB
"I still remember when everyone was in meltdown mode saying last year was a fluke. Sheesh, what a team we have...with some exciting pieces ready to come up &amp; plenty of trade chips we might just get even better.",2021-06-12,['401228004'],TB
Flappy boys keep flapping,2021-06-12,['401228004'],TB
Keep on going!,2021-06-12,['401228004'],TB
Geeee—how can this be?? Didn’t they “gut” the Rotation during the off-season?,2021-06-12,['401228004'],TB
"Our boys just played their hearts out. That was the craziest finish I have ever seen. The water is so fucking warm you guys. My flappy parts feel so fucking flappy indeed you guys. Some years have really hurt. We've all been waiting 12 years to have a chance to break through again. Some of it has hurt so fucking bad. This finally feels like the year. Shortened season or no, that was some Jesus-Approved sports magic. This is such a good feeling. 

2-2.",2020-10-25,['401246390'],TB
"Me too! I just kissed Brett Phillips on my TV. Guys, I'm 33, and I can never remember feeling like this after a game. I'm melting.",2020-10-25,['401246390'],TB
I WAS HERE,2020-10-25,['401246390'],TB
I fell on my knees and started crying.  Yelling obscenities.  Then running in circles.  This was pure magic.  I love being a Rays fan to the end of my days no matter how much the rest of fucking baseball tries to drag us down,2020-10-25,['401246390'],TB
"I’m crying cuz I’ve never seen anything funnier in my entire life than the entire team running around in the outfield acting like airplanes. 

Plz win tomorrow. And FUCK THE DODGERS!",2020-10-25,['401246390'],TB
That game broke my mind. I’ve seen some crazy games but that is definitely top 5 craziest games. I don’t know how to comprehend what I just witnessed.,2020-10-25,['401246390'],TB
"I promised my family I’d suck their D**** if they won, so this is awkward lol",2020-10-25,['401246390'],TB
"I’m still reeling, guys. This is magical.",2020-10-25,['401246390'],TB
"That was amazing! 

I love watching the Dodgers lose, and they lost in an epic way. 

Thank you!",2020-10-25,['401246390'],TB
I lost my voice during that play,2020-10-25,['401246390'],TB
"I was at work when I was listening on my phone and was YELLING at the top of my lungs in that 9th inning and had to calm myself down because we won it.

This surpasses game 5 of the DS this year
This surpasses game 7 of the ALCE of 2008
This surpasses game 162 in 2011

This might be the greatest game to ever exist in Rays history, a day we will all look back upon. I'm unbelievably excited rn that I cant sleep, I feel like a kid again like its christmas eve. 

Un. Be. Lievable. Rays in 6",2020-10-25,['401246390'],TB
"Wild ending, haven't seen a celebration like this since the Mets insane 6th game victory in the 1986 World Series against the Boston Red Sox--But the Red Sox made one error in that final play back then, while the Dodgers made 2 lol",2020-10-25,['401246390'],TB
I forget where I posted it but my wife gave me temporary tinnitus with a loud clap near my right ear and then started crying in joy.,2020-10-25,['401246390'],TB
"With The Rays 5-1 Win Over Oakland, Tampa Bay will move on to the ALDS To Play The Houston Astros.",2019-10-02,[],TB
LOCAL STINGRAY IN GREAT MOOD,2019-10-02,[],TB
I DONT LIVE IN THE TAMPA AREA ANYMORE AND CANT AFFORD TO COME HOME BUT EVERYONE IN TAMPA BETTER FILL THOSE FUCKING SEATS!!!!!!!,2019-10-02,[],TB
Gentlemen. It has been an honor to flap with you.,2019-10-02,[],TB
A's fan here. I just want to say congrats and please keep the Astros and Yankees out of the World Series.,2019-10-02,[],TB
Only one Bay Area gets to win,2019-10-02,[],TB
"Congrats 🍾 

Now go get them ‘Stros",2019-10-02,[],TB
Indians fan here. Rooting for you guys all the way. Good luck and great win tonight!!,2019-10-02,[],TB
YES,2019-10-02,[],TB
"If we're gonna lose in the playoffs, I want it to be to yall. Congrats flappy bros.",2019-10-02,[],TB
Ngl Kevin Cash managed a masterful game against a sneaky good Oakland team.,2019-10-03,['401169054'],TB
What a tremendous game! The Rays continue their great play on the road!,2019-10-02,[],TB
"Is Sogard going to be on the ALDS roster?

Sincerely,

Jays Bro",2019-10-02,[],TB
Kevin Cash putting doubters to rest. Yandy leadoff? Ballsy call but we all saw how that played out. Great calls all night.,2019-10-03,['401169054'],TB
Suck it Oakland!,2019-10-02,[],TB
lol Oakland come on,2019-10-03,['401169054'],TB
"Yankee fan here, long time Charlie Morton fan.  Give em hell boys, this is basically setting up to be Baseball's greatest Upset in history, maybe even in all of Sports.  You got the bats, you got the arms, and from watching the games the past couple years, you Sure as F\*ck can win.  Best of luck!

&amp;#x200B;

Curious, how many pitches did Charlie throw last night?",2019-10-03,['401169054'],TB
,2020-11-07,[],TB
"If I had a nickel for each time this has happened, I'd have 2. Which isn't a lot, but it is weird",2020-11-07,[],TB
Oreos were deemed illegal until 1847.,2020-11-07,[],TB
Hopefully this trend is broken and we go back to the World Series before 2028.,2020-11-07,[],TB
CASH 2020,2020-11-07,[],TB
flappybois doing their part for murica,2020-11-07,[],TB
So you're saying we have to wait at least 8 more years?,2020-11-07,[],TB
Lol try and keep politics out of sports please.,2020-11-07,[],TB
Sorry to burst your bubble but the inauguration doesn’t happen until 2021.,2020-11-07,[],TB
"A new hero has been born. Extra shout out to the Dodgers defense, we couldn’t have done it without them.",2020-10-25,['401246390'],TB
Can we all agree that Brett Phillips will never be allowed to pay for a beer in Tampa Bay ever again? We owe him at least that much.,2020-10-25,['401246390'],TB
"Imagine being a little boy and loving the Tampa Bay Rays

and then you grow up and become a hero for clinching Game 4 of the World Series for them.",2020-10-25,['401246390'],TB
I can't wait for the dance battle after that,2020-10-25,['401246390'],TB
He's local to Tampa bay too!,2020-10-25,['401246390'],TB
"From Brewers nation so happy for Maverick there! Love that guy and miss him in the Brewers system. 

Brewers sub is blowing up with Phillips posts. 

Let’s fucking go Rays take it to LA and take this series!!",2020-10-25,['401246390'],TB
Coincidence ? Dan Johnson threw out the first pitch and it a had Game 162 like ending. The power of Dan Johnson lives on.,2020-10-25,['401246390'],TB
HE WENT TO ST PETE COLLEGE (I think),2020-10-25,['401246390'],TB
"The biggest at bat of his life and he came through. What a moment, holy shit.",2020-10-25,['401246390'],TB
"GREW UP A RAYS FAN AND COMES UP BIG IN THE WORLD SERIES

HOW CAN YOU NOT BE ROMANTIC ABOUT BASEBALL",2020-10-25,['401246390'],TB
"I'm happily married with two kids, but I'm gay af for Brett right now. Rough week and this just helped so much.",2020-10-25,['401246390'],TB
"The man, myth, legend, absolutely gorgeous, 

#BRETT PHILLIPS",2020-10-25,['401246390'],TB
any one have his fox interview,2020-10-25,['401246390'],TB
Royals fan here. Pulling for the Rays to take the series this year. I jumped off my couch when Maverick hit the game winner. Unbelievable game. Best one I’ve seen in a long time.,2020-10-25,['401246390'],TB
Royals fan.   Fucking amazing seeing old fren do thangs.,2020-10-25,['401246390'],TB
"Not taking away from Phillips, but can we do a Taylor and Smith appreciation as well? Fuck that was exciting",2020-10-25,['401246390'],TB
"Royals fan here and phillips is the reason I’m rooting for y’all. Said a little prayer before the at bat to let our boy pull in clutch and boy did he. Flap flap mother fuckers, I’m happy for y’all",2020-10-25,['401246390'],TB
He is awesome...And best looking OFer on the team!,2020-10-25,['401246390'],TB
Hell of a hit,2020-10-25,['401246390'],TB
anyone know where I can hear the Dave &amp; Andy call?,2020-10-25,['401246390'],TB
"He brought out the best and worst of the game in 1 hit. I literally LOL'd at this.
[Benny-Hill-Dogers](https://twitter.com/Camngram/status/1320226829190402050?s=09)",2020-10-25,['401246390'],TB
LETS FUCKING GO BOLTS,2021-07-07,"['401228346', '401344255']",TB
FLAP-FLAP-ZAP⚡️,2021-07-07,"['401228346', '401344255']",TB
What a wild day in Champa Bay.,2021-07-07,"['401228346', '401344255']",TB
ZAP ZAP,2021-07-07,"['401228346', '401344255']",TB
THE BEST GODDAMN SPORTS TOWN IN AMERICA.,2021-07-07,"['401228346', '401344255']",TB
"Let’s fucking go! This year, we *are* next, my friends",2021-07-08,[],TB
Stu would be hard pressed to convince people to move us out of Tampa at this point,2021-07-08,[],TB
Congrats. We need to get it done in baseball now.,2021-07-08,[],TB
"I’m not even an Islanders fan (far from it, Rangers lol) but must be hard for them to take the Bolts to seven games without Anders Lee most of the year while Kucherov also misses most of the year….happy for McDefense though.",2021-07-07,"['401228346', '401344255']",TB
Congrats!,2021-07-08,[],TB
[deleted],2021-07-08,[],TB
Rays need a Tyler Johnson bad.,2021-07-09,['401228381'],TB
"BICEP KING HAS FINALLY DONE IT, THIS IS NOT A DRILL

[VIDEO](https://bdata-producedclips.mlb.com/835a76bc-1a09-4df0-baec-75c240513ab5.mp4)",2021-06-06,['401227944'],TB
"You cannot make this post without a video, AMATEUR!!!",2021-06-06,['401227944'],TB
Somebody screencap a pic of Fairbanks catching that ball lol,2021-06-06,['401227944'],TB
My boy! Saw it live! Freakin sick!,2021-06-06,['401227944'],TB
I hope anti Yandy dude from the other night on here saw that.,2021-06-06,['401227944'],TB
Cou...Could he be back?,2021-06-06,['401227944'],TB
So happy for King Biceps. He had a few hits against the Angels and Yankees that would've left the yard if you flipped the ballparks. Totally due!,2021-06-06,['401227944'],TB
The Yandy Man can,2021-06-06,['401227944'],TB
Magical season this Rays team is having after that slow start.... We as Tampa Bay sports fans are looking down on the rest of the world.,2021-06-06,['401227944'],TB
That stadiums outfield is massive. A HR there is saying something.,2021-06-06,['401227944'],TB
On the same day Jake Bauers gets dfa’d,2021-06-06,['401227944'],TB
They lose 2 of 3 and nearly swept by the Orioles. Just lmao,2021-09-05,['401229102'],TB
The Yankees have more losses to the Orioles in 2 games than the Rays do in 19 games,2021-09-05,['401229102'],TB
Fuck those clowns,2021-09-05,['401229102'],TB
But we have such an easy schedule,2021-09-05,['401229102'],TB
Time to go Buy me a Baltimore Hat online....,2021-09-05,['401229102'],TB
"I know many of you will probably yeet me out the window before you read the entirety of this post, but fellow baseball nerds, please hear me out!

Let me start out by saying that I was NOT a fan of Cash pulling Snell in THAT scenario. Snell was locked in, and visibly, his stuff was as sharp as it had been from pitch 1. Even though Betts has an .892 career OPS against him, the Rays BP had been anything but reliable to that point in the series, and that is especially pronounced with how poorly Anderson had been pitching all postseason.

HOWEVA...let me get into why the Rays just fleeced the Padres. You guys, as a fanbase, enjoy being a *very* competitive team year in and year out, right? There is a very poignant reason for why you guys are able to do that. Speaking as a Tigers fan, who has seen his team become an abomination due to a formerly, chronically barren farm system and inexhaustible spending on players well past their prime, I am green with envy at your front office, and frankly, your shrewd ownership. Yes, Stu is a dick. Yes, I would be furious with the veiled and not-so-veiled allusions to moving the team. Yes, it would be very annoying to see your favorite team be the baseball version of Ebenezer Scrooge, while everyone knows they could easily afford a high-tier payroll.

But THE main reason the Rays remain competitive year in and year out is because of moves like this: trading big leaguers at their peak or right when they start their decline, and relying on their renowned player development and scouting to expedite these supplemental prospects to the Bigs to backfill lost production. Hording cost-controlled prospects on a mass scale allows the team to be extremely well-balanced for years. This gives the team options: Options on when to spend for a FA to fill a hole, options to spend big on a short term trade to make a run at a WS, etc. You guys know this. I'm preaching to the choir.

I know Snellzilla is a fan favorite. I know you probably think he just got dealt for some slapdick prospects, and now he's riding away from you on a trusty steed into the horizon. Blake is on the decline though. Please take a breath as you feel your blood pressure rise from reading that. I say this because of a few reasons:

First, very real durability concerns. I mean this from both a health and inefficiency perspective. Blake is known as an ""Ace"" right? What is the #1 criteria for an Ace? It's arguably dependability, right? What makes a pitcher dependable? I would argue that it's taking the mound every 5th day, and going deep into games, consistently. What is the widely-accepted, blanket number for SP durability? That 30 start threshold, right? Snell has eclipsed the 30 start threshold a grand total of *once* in his career. And he hasn't even hit the mid-high 20's in those other years.  How about the games he does start? 

Of the 108 starts in Blake Snell's career, he has eclipsed:

6 innings: only 43 times

7 innings: only *13* times

8 innings: ZERO times

I don't know about you, but when I think of ""Aces,"" I think of guys like JV, Mad Max, Kershaw, Cole, etc. These are guys who you constantly see grinding into the 7th-9th innings because they pitch so well and so efficiently up to that point in the game that they make their managers' decisons easy. And these are guys who have played for managers and clubs that are *very* analytically-inclined. 

Now WAIT! Wait. I know what you're thinking. ""Well Snell doesn't go deep into games because Cash pulls him so quickly."" Well, let's trust Kevin Cash here. This is a man who is very, very well-regarded amongst his peers who are at the pinnacle of their profession. These are men and women who are so good and smart at what they do, that they get paid MILLIONS of dollars for their services in an uber-competitive industry, while leading teams of Ivy League data scientists and statisticians. Kevin Cash knows what he's doing. You think he would habitually take Snell out of games early on a whim? On the ""eyetest""? Just because he feels his taint starting to tickle? 

This is where Snell stans would normally tout his amazing surface level stats and awards. ""He's got a career 3.24 ERA! He's struck out 648 batters in 556 innings! He won the 2018 CY!"" Yes, but baseball is a ""What have you done for me lately?"" kinda profession. Teams evaluate, pay, and trade players based on projections; on what they hypothesize a player will do in the *future*, not necessarily only what was done in years past. Or at least that's how good teams operate (Looking at you, Tigers-pre-rebuild.)

Can't at least part of that sparkly bottom line be attributed to Cash's wisdom and savvy decision-making in taking him out before those numbers got any worse? Snell's velocity has fallen 10 percentile in the past 2 seasons. His batted ball profile has gotten much worse. His vertical and horizontal movement have receded rather dramatically on all of his pitches except his curveball horizontally, which is probably not even a good thing. 

Blake Snell is a good pitcher though! But the way the Rays deployed him made him even better. Is he an Ace? No, I don't think so. Is he a top 30 SP in baseball? Yes, I think so. Does the arbitrary title of ""Ace"" even mean anything substantive? No, probably not.

Back to the trade though. The best part of this deal for the Padres is Snell's relative team-friendly contract over the next 3 years (10.5, 12.5, 16). The Rays likely backloaded this deal because they knew his decline was inevitable, and that they would trade him anyways. I think they traded him at the peak of his value. What better time than after his masterful WS performance? Him being a lefty also greatly balances out a Padres rotation that just lost Clevy, and already has an overrated-Paddack, a fragile Lamet, a BABIP-friendly Davies, and an unproven or largely meh remainder of potential starters to choose from.

HOWEVA, the Rays get back the #3, 7, and 14 prospects (MLB.com) from a premiere SD farm system, as well as a very toolsy 25 year old, switch-hitting catcher with MLB experience, who was once a top prospect himself not too long ago. Don't you trust the Rays Player Development system to turn Mejia around? I sure do. He'll be the perfect platoon with Zunino. Heck, with the way pitchers peak and plummet so dramatically these days, Patino could be better than Snell as soon as THIS season! Patino is gushing with talent. Cole Wilcox is yet another behemoth for the Rays to tinker with, who can hit triple digits and has two plus offspeed offerings. Does that fit their specialty or what? Hunt adds to their plethora of catching depth; a position that is notorious for having prospects not pan out, or at least not pan out for long.

And the amazing thing is that Snell is expendable for the Rays! Even with losing him and Uncle Chuck, the Rays still have absurd pitching depth in their rotation and bullpen.

This is exactly the type of strategy, pragmatism, and ideology that keeps the Rays raysin'. You guys will be more than fine. You will thrive for the next decade.

Commence the pitchforks and run me out of town, back to /r/motorcitykitties! Happy holidays, y'all.",2020-12-28,[],TB
"Also, you should submit this to /r/baseball.",2020-12-28,[],TB
"Great write up and I agree with everything you said and have even said some similar remarks in my previous comments re: the trade. 

Glad you were able to look at it objectively and not through rays colored glasses.",2020-12-28,[],TB
"I think it’s a trade where at first and for good reason it comes as a shock, but will play out for the better. Think of all of the big names they’ve traded and the Rays have gotten even better over the last few seasons.",2020-12-28,[],TB
"I'm still upset bc I finally got my first Rays jersey for Christmas, and it was Snell's",2020-12-28,[],TB
"Did Erik Neander write this? 

No but seriously, this does make me feel better a little bit, and I thank you for that...I just don’t know if there’s any way we can avoid having a pretty major down year the year after we made it to the WS. And from a fan/optics perspective, that is very concerning when we already have some of the lowest attendance in the league. All of this probably plays right into Stu’s hands for the ridiculous Montreal gambit.",2020-12-28,[],TB
"If I was the Padres, I would've done the same thing tbh",2020-12-28,[],TB
"Happy Holidays. Thanks for the support.

I guess I'll get over it, but most of my grievances come from the fact we've yet to build on on our 2020 to get us back into the 2021. This helps for our future, yes, but wow, we need another starter or two as well as something to bolster the offense, and that still hasn't quite been done yet. 

I can only hope something happens between now and spring training that makes me feel better. I want to believe what you said about options is true and not just the FO having to cut costs just for Stu to line his pocket and do nothing else.",2020-12-28,[],TB
"Full disclosure I’m a Padres fan but I saw this on r/baseball and wanted to respond. 

From just a value perspective I think this is a solid deal for the Rays (obviously it’s bad for baseball that things like this happen, but if you’re gonna move Snell this is a good return for him), but I feel the need to chime in because I think OP is setting some unrealistic expectations for the return. Patino is a great prospect who has a ton of potential, but this post isn’t accurately portraying how developed he is. Tbh I doubt he’ll see much of any major league action next year, it was pretty obvious watching the Padres last season that we rushed him up (which we do a lot tbh). His control was really bad last year and his secondaries need some extra development too, but I don’t think he’ll have too much trouble working his pitches and his control should approach league average as he gets a feel for his entire arsenal. The only thing that worried me about him is his height and that’s just because he reminds me of Anderson Espinoza (as a short pitcher with a ton of velocity). Mejia, at least imo, is the 4th guy in this trade. He was already starting to show signs of decline when we traded for him and that hasn’t slowed at all. He’s not a very good fielder behind the plate so most his value is in his bat which has been dead for the past few years. Wilcox is the prototypical second half of the first round pick, he’s got electric stuff but he needs to work on making better use of it (he’s very hittable rn which makes a lot of people think he’ll be a reliever). Hunt is actually the sleeper guy in this trade and I know a lot of Padres fans have been buzzing about him. All around solid catcher and I wouldn’t be at all surprised to see him be a top 100 or even top 50 prospect this time next year.",2020-12-28,[],TB
"It is a good trade but most of the rays fan base right now is overly emotional from his Postseason and World Series performances. 

I keep getting downvoted for saying it’s a good deal. 

It’s just an emotional time here lol",2020-12-28,[],TB
"I appreciate this well written breakdown but logic and reason won’t make me feel better. This is an emotional pain that can’t be fixed with anything but some combination of time, liquor, beating the Yankees, Zuni Bombs, Lowe Lowe Lowe, and Stu getting everything taken from him by the IRS and the Rays being bought by an eccentric Ybor property developer.",2020-12-28,[],TB
"You're right but it is tough to be a Rays fan when this is what we always do. Like...how are we ever going to have any ""Rays legends"" when we don't keep any players? The closest thing we have now is Evan Longoria. Who we let go. 

Crawford. Longoria. Archer. I could go on. It just sucks that we never keep fan favorites.

But I know what you mean. And I hope you're right.",2020-12-28,[],TB
People are going to be eating their words when Snell's decline continues next season. The rays front office has shown how good at their jobs they are enough times for me to have some faith.,2020-12-28,[],TB
100% agree with you it just stings seeing a core piece like Snell traded with the World Series window wide open. Otherwise on paper this trade is amazing,2020-12-28,[],TB
I wish we would just go into win now mode and pick up players so we can win the WS. Getting rid of Snell right now doesn't help us this season. It's like Stu is trying to shut the window that was just opening so we can compete in the future. I would rather go all in and win the World Series and then worry about the team's future later.,2020-12-28,[],TB
