text,date,time
Great season for the Red Sox that ends with the team on top! ,2018-10-28,23:17
MACHADO FELL TO HIS FUCKING KNEES FOR THE LAST OUT WHAT A PICTURE PERFECT END TO THE BEST RED SOX SEASON IVE EVER SEEN,2018-10-28,23:49
"Took out two 100+ win teams, then the #1 seed from the National League...

But we definitely didn't play any good teams.

Fuck the Yankees and Fuck Machado the Avocado.",2018-10-28,23:55
Man I love all you guys. This has been such an amazing season and I absolutely love waking up every day to read the news and shitposting and memes on this sub. Thanks for an amazing year!,2018-10-28,23:38
"Posted this in /r/baseball, but I’d like to repeat it here:

I love this team.

I love David Price’s complete and total reversal of his narrative.

I love Mookie “MVP” Betts.

I love Chris Sale slamming the door shut.

I love winning on everyone else’s home field.

I love the most dominant postseason run I’ve ever seen.

I love being undefeated after the opposition trolls us.

I LOVE THAT DIRTY WATER! GO SOX!",2018-10-29,00:03
"119 wins, 11-3 in the postseason after beating two 100 win teams (and one of those losses took 18 innings to put them away), the league MVP — lot of recency bias but this legitimately might be the most dominant Boston sports team of the 21st century ",2018-10-28,23:53
"Machado went down on his fucking knees!

Machado went 0-4.

SALE.",2018-10-28,23:47
I am so proud of this team. Damage done!!!,2018-10-28,23:19
I wonder when they’ll play some good teams. ,2018-10-28,23:28
4-0 IN WORLD SERIES WITH [FLAG LOGOS](http://news.sportslogos.net/2018/03/08/2018-world-series-logo-and-presenting-sponsor-unveiled/).,2018-10-28,23:34
Comment has been edited ahead of the planned API changes.,2018-10-28,23:25
"DAMAGE: DONE

WATER : DIRTY

CAROLINE: SWEET

BOSTON: MY HOME

TWO OUTS: YOUR KRYPTONITE

FUCK: MACHADO

MVP: PEARCE

WORLD SERIES: CHAMPS",2018-10-29,00:08
"Not gonna lie, when the Sox acquired Steve Pearce midseason, I thought he was a middle reliever. Boy am I glad to be wrong. 

This is the greatest Red Sox team I’m likely to ever see. And boy am I glad I saw this. Cheers lads to an absolutely incredible season!! 🥃🥃🥃",2018-10-28,23:48
FREE BEER AND PIZZA BACK AT MY PLACE! ,2018-10-28,23:39
"As I sit in my tiny apartment near Massachusetts General Hospital watching my TV, NOTHING makes me happier than watching that bitch Manny Machado be the last out for MY BOSTON REDSOX TO WIN THE WORLD SERIES AGAIN

CANNOT WAIT FOR THE PARADE!!!!!!",2018-10-28,23:45
"11-3. When do we play a good team, tho?",2018-10-28,23:39
Congratulations from South America. I knew this year was our year. I knew my team wouldn't dissapoint. RedSox always! ,2018-10-28,23:22
Striking out Machado was the perfect way to end. So glad Sale got in to finish the job! ,2018-10-28,23:45
Machado striking out was such an “icing on the cake” moment. Fuck the Yankees! ,2018-10-28,23:53
"I think Eovaldi dragging his giant sack out there in game 3 was my favorite part of the series, even though it was a loss. Nunie putting it all out there was impressive too. What were your favorite moments??",2018-10-29,00:28
We deserve this. ,2018-10-28,23:28
"“Alexa, play Dirty Water!”",2018-10-28,23:48
"This hurts the Yankees chances of winning it all this year doesn’t it

#damagedone",2018-10-28,23:54
Win. Dance. Repeat. ,2018-10-28,23:28
Does this mean we finally played a good team?,2018-10-28,23:45
"Will the sports media concede that we’re actually a good team now?

Edit: ESPN has us fourth on their new “Too Early 2019 Power Rankings”. I can’t believe I was that naive.",2018-10-28,23:27
Hanley Ramirez died for this,2018-10-29,00:05
"What a magical season. Every team that’s won it all for us has been so fucking likable and so fucking gritty, the modern history of this team is nothing short of incredible. I’m really lucky I got to watch these stupid baseball boys play such amazing baseball. Love everyone! See you this offseason! ",2018-10-28,23:38
[deleted],2018-10-29,00:07
"Firstly FUCK THE YANKEESSSS!!

Secondly I’m pretty roasted right now.. It’s 2:36pm in Aus and I’m drunk already 😂😂

Thirdly I hope I’ll be celebrating Liverpool winning the league later next year to make it a RedSox/Liverpool Double!! ",2018-10-28,23:37
"For years I have mocked my father for crying during sporting events. From rewatching miracle, to 04, to the first Pats Super Bowl, and during live games like the 13 Sox, or 11 Bruins. My mom, bro, and I judged him.
I won’t anymore...
After the final, beautiful out, I cried like a baby, right there along with him. I love this team, and I love my dad",2018-10-29,00:54
We WaNt BoStOn,2018-10-28,23:48
"THE HUNT FOR RED SOXTOBER IS COMPLETE!! 

DAVID PRICE YOU LEGEND. TOTAL REDEMPTION. 

I LOVE THIS TEAM. I LOVE THAT DIRTY WATER. ",2018-10-28,23:55
"I'm at my college dorm watching this game. I just hugged a Red Sox fan I've never met before. Baseball is magic.

",2018-10-28,23:53
White Sox fan here. Glad you guys got Chris Sale a ring. Congrats on the dominant season and the well earned Championship.,2018-10-29,00:09
"So many guys stepped up, especially our bullpen. Price has completely redeemed himself by dominating against some of the top pitchers in the league, Kelly was lights out, and Pearce was absolutely clutch. So proud of this team ",2018-10-28,23:47
Surely we're gonna face a good team in the next round,2018-10-28,23:56
"How's that for damage?
This may have been the most magical Red Sox season in my life, and I feel like I missed half of it, even though I was at the games where Joe Kelly beat up Tyler Austin and Mookie had his first career walk off, and all the meme magic, and I went on a tour of Fenway, and the beating the Yankees in the playoffs, then the defending MLB Champions, and the team from the fakest city on the globe with Dbag Machado and none other than Dave Roberts as the other teams manager, Aaron Boone as the Yankees manager, and Piss Missile Pearce being the hero, and Jared Carrabis, and holy fuck it's gonna be hard to top the 2018 Boston Red Sox Season, except with 2004. Get the Boats ready, my interest in baseball as a sport is pretty low but I'll be damned if the Red Sox aren't my team and the Yankees don't suck. Suck it, Judge, Stanton, Verlander, Altuve, Machado",2018-10-29,00:27
"Just stopping by to say Congratulations, Red Sox fans! Your team was truly great all year round and a pleasure to watch. Enjoy the celebration!",2018-10-28,23:53
153 more days till Opening Day 2019,2018-10-29,00:03
"Can I get a HELL YEAH BROTHER?

Can I get some CHEERS FROM IRAQ?",2018-10-29,00:57
Fenway status: defended!,2018-10-28,23:40
David Price is my dad,2018-10-28,23:47
"7-0 after getting trolled by the opposing team

That's how you do damage ",2018-10-29,00:30
"**CONGRATULATIONS RED SOX!** 

After the fantastic season the Sox had, I'm thrilled to see you guys cap it off in the best possible way. 

Having not seen the Sox in action very often this year, I enjoyed the chance to learn about your team (and I'll be talking about Eovaldi's Game 3 heroics for years!). 

Also - I really appreciate this sub's hospitality to a purple-mountain-flaired Rockies fan like myself. I had a great time watching alongside you guys...thanks for being a great fanbase. 

**Enjoy the championship life!**",2018-10-28,23:58
"I just want to say wherever you are, I love you Red Sox Nation! ",2018-10-29,00:49
That loud as fuck Yankees Suck chant right before the awards was priceless. FUCK THE YANKEES,2018-10-29,00:04
California Love and New York New York... the ultimate trolls lmao,2018-10-29,00:22
"After Sale hadn't performed to the standards he likely expects of himself, Cora allowing Sale to end the game was just wonderful.

And if this is Playoff Price going forward, I can't wait for the seasons to come.",2018-10-29,00:30
"Guys. It’s not all fun and games. The bruins are only 14:1 favorites to win the Stanley Cup. The Celtics are only the unanimous favorites to win the *conference*. The Patriots are only in what, like 2nd place in the AFC? 

And on top of that, now I have to face the existential debate of whether or not the 2018 Red Sox are a better team relatively than the 2007 Patriots. 

This is hard guys. Tomorrow I’m going to be up until 12 watching the Pats win 64-3. I need my sleep. 

When will it ever get better for us?

FUCK MACAHDO 

FUCK THE YANKEES

FUCK THE JETS

FUCK THE HABS 

FUCK THE LAKERS

WITH ALL DUE RESPECT TO EVERYONE...NO JUST KIDDING FUCK EVERYONE ",2018-10-29,00:59
"Yo since Sale clinched the final game in the world series

was it a Closeout Sale?",2018-10-29,00:50
"Congrats to the Red Sox on the win! Just stopping by to say hope you enjoy your celebration in Boston! 

Also know that all of SF appreciates you guys! ",2018-10-29,00:17
Congratulations from a Dodgers fan.  Great team.  Great player.  Great franchise.  Hopefully we will meet again in the world series sooner than another 102 years later.,2018-10-29,00:36
Machado on his knees striking out was icing on cake ,2018-10-29,05:05
OH! FUCK! YEAAAHHH!!!  Damage Done.  Championship Won.,2018-10-28,23:37
"I love you guys! I've been a fan since birth, and this was a special team.  Ya'll are an incredible part in fostering my hype this season. I love checking this subreddit everyday, and I'll be here everyday for the offseason! Go Red Sox! Rule 3! I love you!",2018-10-29,00:08
Machado bending the knee on that final strikeout will take me all the way to February.,2018-10-29,00:51
Rule 3! https://twitter.com/Cut4/status/1056770179923873792,2018-10-29,00:57
"For me...I think about those Sox fans that did not live to see our boys break the curse. 

I am fortunate enough to see them win it 4 times. 

As a proud fan and member of this sub, I am glad we can share this all together from all different places high and low.

Lets give it up to the r/redsox family and those fans who are long gone and to those that are yet to be born.

Love you all.

Alright boys &amp; girls lets celebrate!


",2018-10-29,01:31
My wife and I got together in 2014. She has never seen any of my teams win a title since. She told me tonight that i looked happier than our wedding day......guilty. Love my wife and love these fucking Redsox and love all of you!! From south Louisiana Geaux Redsox!!!!!!,2018-10-29,00:27
"Fresh pasta from our little brothers over at r/nyyankees


You know what they’ll never be able to take from us?

We root for the greatest team on the face of the earth. We’ll always have something better than them. We’re the Yankees. The *Yankees.* They’re still the subject to our foil, the littlest of brothers, the great to our greater. When the dust settles, there’s more to be proud of in New York. We’re just counting the days until this celebration is a distant memory behind our grand celebration. Everybody keep your chin up, cause we’re still the greatest.",2018-10-29,00:08
WICKED FRIGGIN PISSA,2018-10-28,23:51
"1. GO SOX

2. FUCK AROD

3. BEST TEAM EVER 

Am I missing anything?? Nope!!

PSYCHE! FUCK THE YANKEES",2018-10-28,23:58
We had a phenomenal year. Those guys earned the hell out of this and made this season a ton of fun to watch ,2018-10-28,23:37
D O D A M A G E,2018-10-28,23:43
FUCK THE YANKEES,2018-10-29,00:05
"By far the most fun I've had watching a season with this team. I came out of my baseball dark ages in 2016 to watch Papi's season, and had so much fun following the team that I couldn't stop. Love all the guys on our roster and I'm glad all of them got their rings.",2018-10-29,00:16
Vasquez and Moreland fanfiction is probably a thing now,2018-10-29,00:18
 [Now that's a lotta damage!](https://imgur.com/a/NRYDtYU) ,2018-10-29,00:24
Did anyone else get nervous when FOX played “Dirty Water” before the game was over?,2018-10-29,00:25
Bullpen a huge difference in the series just like we all predicted ,2018-10-29,00:31
WORLD SERIES WINNERS BAYBEEE I JUST GOT BACK from the common and am so happy mark my words im here im drunk im high and im proud lets go red sox woooooo,2018-10-29,00:55
Will we play the good teams in spring training?,2018-10-29,01:39
Congrats guys! And thank you for putting those bitch ass Dodgers in their place. ,2018-10-29,08:59
Imagine winning the Wild Card with 100 wins and then losing to the best team in baseball. Hate to see it. ,2018-10-29,09:30
Who else spent way too much money on Championship merch last night/this morning?,2018-10-29,11:45
"Verdugo strikes out to end it in a perfect ending. The Yankees are knocked out of the World Series in Game 5.

Fuck New York. Rule 3 forever.

Post your memes and celebrations in here.",2024-10-30,23:57
"https://preview.redd.it/cwlc1hyb34yd1.png?width=447&amp;format=png&amp;auto=webp&amp;s=1b9e998445d6dd99a8033016c09e0a65c7da1280

LMAO",2024-10-31,11:39
To think that since their last title they’ve burned through some 3.5 billion dollars 😂,2024-11-20,08:35
I’m from Boston and now live in San Francisco. I had to explain to my friends why it was good the Dodgers won and why Dave Roberts is a legend! They hate the Dodgers like we hate the Yankees.,2024-11-06,22:12
Your team didn't even make it there. Just wait till next year..,2024-11-04,18:57
Let's keep this going until Opening Day of the 2025 MLB season...,2024-11-04,13:22
"At the Dodgers parade, the crowds were screaming ""Yankees Suck"" repeatedly",2024-11-02,22:42
IT'S NOT TOO LATE FOR QUEENS TO JOIN THE PARTY IS IT???,2024-11-02,18:19
Is the patriots jet real? If so best troll job ever,2024-11-01,18:12
Lol,2024-11-01,18:11
The best second place team money can buy…. I wish the rivalry would come back via more games between Sox and yanks. Teams don’t need to play everyone each year. Focus more on regional play,2024-11-01,14:50
"I don't like NL. I am 100% an AL girl. But more importantly, anyone ANYONE who bests the Yankees is gold in my book. Last night, I was a Dodgers fan.",2024-11-01,00:18
Nothing can unite America more than watching the Yankees lose. Maybe they really are America's team LOL,2024-11-01,00:18
it'll be interesting to see if Yankees can't resign Soto since they gave up a lot of players for him,2024-10-31,23:17
Honestly it's better how they lost than if they lost in an earlier round. Its the best. Last night was a dream collapse after thinking they may actually get enough momentum to come back.,2024-10-31,22:11
"Fuck Alex Verdugo  
Fuck Aaron Boone  
Fuck Giancarlo Stanton  
Fuck Aaron Judge  
Fuck Anthony Volpe  
Fuck Gerrit Cole  
FUCK THE YANKEES",2024-10-31,22:05
Joe Kelly gets a ring. Fight Club goals!,2024-10-31,21:21
"Fuck them.

YED is a great day.

My 12 year old was screaming and jumping for joy with me.

I told him these are the moments we remember on out death beds NOT how much money we made or scores we accumulated

Also

Fuck Those Assholes.

Happy YED Day To all!!!",2024-10-31,20:38
I have loved watching Kike!  I miss him.......,2024-10-31,19:14
"Was browsing the Athletic today and saw the headline ""Yankees' Aaron Boone, with future unsettled, 'heartbroken' after World Series loss""

Aaron Boone is heartbroken?  Boo-fucking-hoo.  Fuck that guy forever.",2024-10-31,18:52
"If they have to make the postseason, this is absolutely my pick for how it ends. Down three games in the series, they pull off a win to give themselves hope for a dramatic finish. Up by five in the fifth inning, they're poised to put the game away only to blow the whole thing with some of the worst baseball I've ever seen. The team and their fans have to be completely crushed. And it's GLORIOUS. This was way better than them just getting swept.",2024-10-31,17:44
"I hate both teams, but I hate the Yankees much more.",2024-10-31,17:02
That Jomboy was crying like the little bitch that he is.,2024-10-31,16:54
Yankee fan here.  Yankees blew it on their own.  Sort of reminded me of the Billy Buckner game for the Sox.,2024-10-31,15:51
"I’m so happy for mookie 

Fuck the Yankees",2024-10-31,15:46
"Verdugo is a punk. That stare down at the end of the game as he strikes out. Brought me a lot of joy. 

Watching Aaron judge completely tank in the playoffs. 

Not even a Mickey mouse ballpark can save them. 

Yankees lose, Yankees suck.",2024-10-31,15:27
"If only those fucking meatheads were there to ""patrol the wall"" in game 5, this never would have happened.",2024-10-31,15:26
"Johnny Pesky, Bob Stanley, Rich Gedman, and Bill Buckner are finally off the hook.",2024-10-31,15:18
"Good for Mookie.  Also, this Gypsy curse from last night will last for decades.  Enjoy!",2024-10-31,14:47
The Yankees are just not good at baseball.,2024-10-31,14:44
"https://youtu.be/B0dC6z-nGYw?si=3uuJ7ZctU8ydJUlr

Cinema",2024-10-31,14:22
#ITS YOUR CURSE NOW YANKEES,2024-10-31,14:22
Does anybody have a montage of the three defensive lapses?,2024-10-31,13:37
Honestly as Yankee fan I take great pride that you guy enjoy us losing so much because it just shows how much better we are on average. They didn't win this year which stinks but they have been a fantastic baseball team for a while now. Hope you all enjoyed this week as much as I have been able to enjoy the entire season.,2024-10-31,13:34
"On the 20th anniversary it was really nice to see the Yankees not pull off their own comeback. The real pack of frauds. Overpaid, underperforming",2024-10-31,13:25
"This is great all they ever talk about is their 27 championships but consider us the last two years (0 expectations beyond our rosters improvement and a desire for ownership to actually spend money) and consider them for the last 15 years marching out all that talent and not going all the way. On paper they have the best roster in the MLB every 7/10 seasons, and top 3 basically every year. Teams built to win the World Series and they’ve come up short so much recently. Fabulous",2024-10-31,12:58
Makes me realized how much I miss Mookie.,2024-10-31,12:56
This loss was pure cinema!,2024-10-31,12:56
[removed],2024-10-31,12:49
"I like Rizzo, but not enough to root for the Yankees",2024-10-31,12:48
I WILL FOREVER LOVE MOOKIE BETTS,2024-10-31,12:46
Id post the ewoks dancing and playing drums on Yankee Helmets I could,2024-10-31,12:34
https://preview.redd.it/vee9gqx8d4yd1.jpeg?width=1242&amp;format=pjpg&amp;auto=webp&amp;s=8cfdb9ba6f4ca5f8ffa4b22374c46ce3d366ddd9,2024-10-31,12:34
DAAAAAA JAAANKKEEEESSS LOOOOOSE,2024-10-31,12:31
"Banned from r/baseball for three days for this?

&gt; Don't let this distract you away from Cole signing with the Yankees thinking he was going to win a ring only to watch his former team in 2022 win and himself being one of the reasons he lost at home tonight!

Haha Yankees fans are **NOT** happy right now. They can all go sit on a cactus.",2024-10-31,12:21
https://preview.redd.it/8xzceyxqa4yd1.jpeg?width=1284&amp;format=pjpg&amp;auto=webp&amp;s=b084b9e0459781cfa148500bedd74a1fe4e0ba60,2024-10-31,12:20
"Cardinals fan here.

*ahem*

![gif](giphy|YVkqPj64xCwRao3cBj|downsized)",2024-10-31,12:08
I think we can say the curse of the Bambino is long gone and the curse of the Verdugo trade will haunt the Yankees for a century.,2024-10-31,12:04
Fuck the yankees.,2024-10-31,12:03
"I sent so many ""what happened to your Yankees buddy?"" Texts this morning it was such sweet revenge",2024-10-31,12:02
"Wait, who? The Yankees?

They were big last millennium, right?",2024-10-31,11:52
One thing that continually pissed me off about the broadcast was the repeated claim that no team had ever come back from an 0-3 deficit in all of history.,2024-10-31,11:43
"Sad sad, cry cry.",2024-10-31,11:39
"every yankees, lakers, and cowboys loss is a victory for humanity.",2024-10-31,11:38
"Yankees fans thought this series was going back to LA haha 🤣🤣🤣

Judge is a fucking clown. WOAT player in October.

I love it.",2024-10-31,11:26
"So satisfying. Watching the Netflix 04 doc right before the WS rekindled some of that hatred I grew up with in the 00. The “greater than thou” attitude, the clean cut, the suits and ties,  the smug expectation from Steinbrenner and fans that NY should be in the WS every year. It’s almost like this attitude that the WS is “their thing.” It is so incredible satisfying to see them FAIL for a decade +.",2024-10-31,10:59
Worst meltdown in WS history 🤣,2024-10-31,10:51
"Giants fan here.  Just want to say how much I appreciate this level of hatred.  I wish it was us with a Dodgers losing celebration thread, but that’s how it goes sometimes.",2024-10-31,10:51
People are sleeping on the fact that we traded Verdugo to them to literally seal World Series loss for them.  I am so happy we made that trade.  We have some pitching arms (from one of the best farm systems for pitching) for the next few years and in return we gave the Yankees a World Series loss.,2024-10-31,10:46
The best thing about it was the Yankees winning game 4 and their fans desperately thinking they still had a chance. No team going down 3 games to none in the World Series has ever forced a game 6. And only one team in the history of Major League Baseball has ever blown a 3-0 series lead. Theeeee Yankees LOSE! Theeeeeee Yankees LOSE!,2024-10-31,10:42
DAAAAAA JANKEES LOSEEEEEEE,2024-10-31,10:35
https://preview.redd.it/4czcseq5r3yd1.jpeg?width=720&amp;format=pjpg&amp;auto=webp&amp;s=14e78fdbfb10537b3caa905c4a5c0efac5fb094c,2024-10-31,10:30
"Gratz to the Dodgers. In a way it's almost like revenge for all the times they lost the Yankees while in Brooklyn. 

But I just love seeing the Yankees lose most of all.",2024-10-31,10:24
Let's go!  Good job LA bros.,2024-10-31,10:23
LETS GOOOOOOO,2024-10-31,10:22
"I went to bed the Yankees were up 4-0 already, putting out celebration articles about mashing and turning things around, Judge finally showing up.",2024-10-31,10:17
Wonderful day :),2024-10-31,10:17
Gentlemen sweep.,2024-10-31,10:10
Judge not lest ye be Aaron Judged,2024-10-31,09:59
DAAAAAAAAA,2024-10-31,09:58
Fuck em!,2024-10-31,09:46
daaaaaa jankees lose,2024-10-31,09:42
Cursed by gary greaseball and freddy fatfingers... laughing still?? Betts for the title,2024-10-31,09:41
"Now, even in the Bronx, they're saying ""Aaron Fucking Boone""",2024-10-31,09:41
"That defensive meltdown was so glorious! And I love that our guy, Mookie, drove in the winning run in their house!

Still pissed that we let him go! 🤬",2024-10-31,09:38
"Big Papi to Jeter:
NOT SO FAST! BIG PAPI’S GOT THIS!
AAAAAHHHHHH HAHAHAHAHA!
AAAAAHHHHHH…",2024-10-31,09:38
"Me reading /r/ NYYankees right now

https://preview.redd.it/9hvuni34h3yd1.png?width=637&amp;format=png&amp;auto=webp&amp;s=03d7c00e33badf5454f956a7785832854d8769cb

  
EDIT: Lol, some butthurt Yankees fan reported me to RedditCares. Get fucked Yankees, start spreading the news!",2024-10-31,09:34
They didn’t just lose. They fucking embarrassed themselves in game 5 lmaoo,2024-10-31,09:21
LA transplant living in Boston. Was so great to see the yanks implode in the 5th. Even better to see the Dodgers win!,2024-10-31,09:16
https://preview.redd.it/5d5kproed3yd1.jpeg?width=828&amp;format=pjpg&amp;auto=webp&amp;s=e1c52d4782ade7d5512bee8b5000dc9b7a7fb526,2024-10-31,09:13
![gif](giphy|3ohhwfAa9rbXaZe86c|downsized),2024-10-31,09:12
"This one felt so good because they almost got swept, had hope after game 4, then got humbled back by blowing a 5-run lead, and then Dugie striking out to end it AT Yankee Stadium.",2024-10-31,09:11
A large part of the Yankee demise goes to Judge. He was MIA at the plate for 95% of this series. Then drops a routine fly in center that opened up the floodgates in the 6th. And he should’ve laid himself out for that fly to center that wouldve ended the inning instead of letting it sail over his head.,2024-10-31,09:11
Staaaart spreadin’ the newssssss,2024-10-31,09:10
You can always count on the Yankees to choke when it counts.,2024-10-31,09:10
"I have to admit, after those two idiots ripped the ball from Mookie's glove, and the Yankees with a statement win in Game 4, then Judge actually doing something, I stopped following along when it was 5-0. I figured there was a momentum shift and the series was going 7. Imagine my delight waking up this morning to this news!!! Congratulations to the Dodgers - especially Mookie. And Kike!! I feel better. :)",2024-10-31,09:06
This makes me so happy,2024-10-31,09:06
What time does the parade start LOL,2024-10-31,09:01
The next best thing to the Red Sox winning the World Series is the Yankees losing it.,2024-10-31,09:00
This is pathetic. We can celebrate when our own embarrassment of a team accomplishes something. Until then this makes us look like losers,2024-10-31,08:55
Red Sox West beats the Jankees!,2024-10-31,08:54
"My favorite team of anything ever is the Red Sox.

Second favorite team is ANY team that beats the Yankees and makes their fans weep.",2024-10-31,08:50
"https://twitter.com/baseballhall/status/1486115783881240577?s=21

Big Papi is headed to Cooperstown! He is the only player elected by the BBWAA",2022-01-25,18:16
Will hof release an Ortiz jersey with the hof patch?,2022-04-08,20:07
🙏🙏🙏🙏🙏,2022-02-04,14:33
"Yo the lengths they are going to over on /Yankees is astounding. Everything from ""David Ortiz is a cheating piece of shit"" to ""David Ortiz beats guys wife"" to ""he's a shitty guy, that's why he got shot, for banging some drug lord's wife"". Dark times over in Yankee world.",2022-02-04,01:38
I thought the induction was in July.,2022-01-28,06:37
"I just realized that Remy didn't get to see Papi get in.

Now I'm crying again.",2022-01-26,19:24
"So Happy for him!!!

Also fuck Rob Parker!! That guy is a blowhard moron voting for Sosa over Papi!",2022-01-26,18:26
"I didn’t expect it to happen so fast cause he’s a DH, but I believed it should",2022-01-26,15:40
DAAAAAAAAAAAA...........,2022-01-26,12:19
