text,time_of_post,game,team
I don't have a problem with the trade for value reasons. I have a problem with the trade because its part of a bigger issue with management. This would sting ALOT less if we wouldn't have to constantly think about how we might not get back the value we have to trade away for financial of all reasons. The FO turns something into nothing all the time but the biggest cost is usually time for development for when we can be a contender,2020-12-28,[],TB
"I agree with everything that you said. I think Snell is getting a bit overrated but I also think that he fits the 3-4 year window that the Padres have right now. I like the headline we got out of Patiño, just wish there was a bit more. My issue with the trade is Mejia. Overall I’m happy with the trade though.",2020-12-28,[],TB
"Thanks, dude! You made me feel better.",2020-12-28,[],TB
I love this write up.,2020-12-28,[],TB
You’re absolutely right. Can’t fall in love with players or else you’ll be stagnant like the Phillies and Angels,2020-12-28,[],TB
"To me jts a lot like the Evan Longoria deal. It makes sense but it hurts because he is like *the* guy for the Rays, even if we have suitable replacements ready to go.",2020-12-28,[],TB
Fair enough but I still think Sternberg is a fucking idiot.,2020-12-29,[],TB
"You son of a bitch, you convinced me

This is no slapdick argument",2020-12-28,[],TB
"Couldn't agree more sir. Now, take my upvote.",2020-12-28,[],TB
"I think you're right, sold him when his value was high, got some good prospects.  This team has a history of winning these types of trades.  The emotional part of it is tough because this must be the only team in pro sports that even after very successful seasons, the top players are let go or traded.  So to see two fan favorites in Snell and Morton leave is tough.  

But I'm confident in five years we can look back and say it worked out well...but today, it's like damn!",2020-12-28,[],TB
Hopefully in the long run it works out but definitely stings right now since he was definitely a fan fav,2020-12-29,[],TB
"I just have to say that was a very accurate assessment of the Rays as an organization.  Long gone are the days of star players staying with the team they were drafted by.   The durability issue you raised are spot on.  Like it was said before, looking at the situation through different colored glasses.  Good job man.",2020-12-29,[],TB
this aged well,2021-06-20,"['401228128', '401228113']",TB
"Lost me at Patino better than Snell this season. I'm a Patino fan and have him on my fantasy dynasty team as a potential no 1, but come on, it will not be this year. That's too much coolaid I'm afraid",2020-12-28,[],TB
"I trust the Rays front office, we’ve fleeced basically every team we’ve made a trade with in the past 2 years (including the Daddies...I mean Padres). Plus I’m just happy we’re finally addressing our catcher depth. But the funniest part of this were the words “sign free agent to fill hole” and “options to spend money on short term trade”",2020-12-28,[],TB
"Welcome everyone to the 2019 post season. 

It has been a been a while and Reddit and its baseball community,  as whole has grown a lot.

I want you all to remember a few things:


Please be curtious to our guests, there may be an influx of new users in our game chats so lets keep our fan base growing.

 Please don't troll in other teams subreddits, you don't like it when its done to us so please don't do it back.

Last but not least, Always remember to Defend the Trop. 


Join our subreddit discord server. It's a nice place to conversate https://discord.gg/F7MadRX


Also, fuck the Yankees.",2019-09-29,['401077157'],TB
"FLAPTOBER BITCHES!!!!

FUCK ALL THE HATERS, THE PRETENDERS, AND THE JEALOUS MOFOS

WE HERE",2019-09-29,['401077157'],TB
Twins are going to beat the Yankees. You heard it here first.,2019-09-29,['401077157'],TB
[deleted],2019-09-29,['401077157'],TB
Good luck guys,2019-09-30,[],TB
Fuck the A’s,2019-09-29,['401077157'],TB
Angels fan here. Rooting for you guys in the wild card and I hope you crush the Astros.,2019-09-30,[],TB
Fuck every other team in October,2019-09-29,['401077157'],TB
"I like both teams, but I’m rooting for you guys.",2019-10-01,[],TB
Did reddit exist when the Rays made the post season last?,2019-09-29,['401077157'],TB
Discord link has expired.,2019-10-04,['401169075'],TB
Discord link expired,2019-10-06,['401169079'],TB
So you guys call it Flaptober? I'm sold can I hop onto the bandwagon,2019-10-10,['401169091'],TB
Flap flap bitch!,2019-10-03,['401169054'],TB
Conversate is not a word. Let's not give anyone more ammunition.,2019-10-01,[],TB
"Hahaha. After how obnoxious and horrible Yankees fans were this season (and every season), this deserves its own thread. Sit down on the couch with the rest of us ya bums. 

Fuck The Yankees",2019-10-20,[],TB
Fuck the Yankees and their payroll and their fans.,2019-10-20,[],TB
"This feels really, really good. I've been so concerned the Yankees were winning it all this year. They seemed like they just couldn't do anything wrong. A full decade without a Yankees WS appearance... I almost feel as spoiled as a Yankee fan does most of the time. Fuck the Yankees forever, Rays winning AL East in 2020.",2019-10-20,[],TB
That inning went about as well as it could’ve. Domestic abuser Osuna blows the save and then domestic abuser Chapman blows the series. Fuck em both. Still like the Astros as a whole more than the Yanks,2019-10-20,[],TB
"F


T


Y",2019-10-20,[],TB
Glad to see the Astros win. Rooting for the Nats tho.,2019-10-20,[],TB
FUCK EM,2019-10-20,[],TB
"I love it.  I'll be rooting for the Nats in the WS, but I'm so glad the Yankees are out.  I was really worried there in the 9th.

FUCK THE YANKEES!!",2019-10-20,[],TB
We like that,2019-10-20,[],TB
d’Aaaaaaaaa,2019-10-20,[],TB
I'm dying laughing. Aroldis Chapman is a huge bitch. Big d'Arnaud energy from Altuve there. Congrats Houston and fuck the Yankees.,2019-10-20,[],TB
"Angels fan here stopping by to say FUCK THE YANKEES, good luck next year in tb and I hope the stadium solution is resolved",2019-10-20,[],TB
I remember thinking how much the ALCS was gonna be since I was still salty about the Astros. Then after watching for 5 minutes remembered how much more I hate the Yankees lol.,2019-10-20,[],TB
Fuck every single Stankees fan,2019-10-20,[],TB
[tasty pasta](https://i.imgur.com/5v4FrfL.jpg),2019-10-20,[],TB
Scrolling through my thread only a post apart is the r/minnesotatwins thread equally as elated at the Yankees elimination. We should all join in celebration and FTY!,2019-10-20,[],TB
"As an Astros fan, I can honestly say the ALDS was much more stressful than the ALCS. Cheers to the Rays winning the AL east in 2020",2019-10-20,[],TB
Fuck the Yankees,2019-10-20,[],TB
This makes my post-season grief at losing in the ALDS a little better.... :),2019-10-20,[],TB
Now the Nats need to win the World Series,2019-10-20,[],TB
"We kept it tighter than the Yankees did, to be fair though it was best of seven. But still what an utter domination by the Astros.",2019-10-20,[],TB
Fucking savages in the tee box!,2019-10-20,[],TB
I was rooting for the Yankees. Was too salty after the Astros series to even think of rooting for them.,2019-10-20,[],TB
sAVaGEs,2019-10-20,[],TB
Fuck the Yankees!,2019-10-20,[],TB
I feel we can  rightfully claim a tie for second place if the Astros win it all,2019-10-20,[],TB
Lmao those cocky bitches.,2019-10-20,[],TB
LETS GO NATS,2019-10-20,[],TB
[removed],2019-10-20,[],TB
,2017-04-02,['370402130'],TB
"FUCK THE YANKEES, RED SOX, AND BLUE JAYS.

LONGO FOR MVP, ARCHER FOR CY YOUNG, KK FOR SEXIEST MAN ALIVE.",2017-04-02,['370402130'],TB
162-0 CONFIRMED ,2017-04-02,['370402130'],TB
MOST HOME RUNS AND RUNS SCORED IN MLB TOO AND LOWEST ERA OF ANY STARTER BELONGS TO CHRIS ARCHER,2017-04-02,['370402130'],TB
CAN YOU SAY 2017 WORLD SERIES CHAMPIONS?!,2017-04-02,['370402130'],TB
I don't want to curse anything but I predict we go 162-0 and Joe Maddon/Zobrist come back for funsies to help us win the World Series.,2017-04-02,['370402130'],TB
I'M SO HAPPY! I LOVE THIS TEAM I LOVE BASEBALL!,2017-04-02,['370402130'],TB
It's only upwards from here!!,2017-04-02,['370402130'],TB
I SEXUALLY IDENTIFY AS MALLEX SMITH.,2017-04-03,[],TB
Why??? He gave up two hits and they were 4 or 5 innings apart... And you yank him???? Why??? he was pitching another masterpiece of a game... Better than game 2... I'm sorry rays fans heart breaking IMO.,2020-10-27,[],TB
He was pretty much in command. Dodgers had no clue. It was like letting them back in the game. Unbelievable.,2020-10-27,[],TB
"One of the worst managerial decisions I've seen in sports. If there's ever a time to put analytics aside, it's the world series when your pitcher is hot and pitching a shutout to hold on to a slim lead. Let the players play.",2020-10-27,[],TB
Cash pulling Snell is aging like a fart. This is not good.,2020-10-27,[],TB
Honestly it was his just electric stuff and they yanked him for a struggling anderson against the top of the lineup who was 0-6 with 6ks.... Dude just wanted to show his managerial presence,2020-10-27,[],TB
[deleted],2020-10-28,['401246392'],TB
"It doesnt matter. We need to score more than 1 run to beat LA. The bats failed us, without Randy we arent even here.",2020-10-27,[],TB
And to put in a mismatch who’s allowed a run 6 game straight. Lol,2020-10-28,['401246392'],TB
The talent of this team is what made Cash. Cash did not make up the talent of this team. He’s misused it. A better manager and we might be in a game 7,2020-10-28,['401246392'],TB
"I was just texting my friend about this. Why tf do you yank Snell? Instant karma that Anderson gives up the tying run. 

Ride your hot arm and don’t micromanage shit.",2020-10-27,[],TB
"If Snell was kept in a couple extra innings and ended up giving up 2 more runs, nobody would say anything, it would just be bad luck. The catastrophic reaction here is more of a product of status quo bias than the wrong-ness of this decision.

For all we know, Morton would have given up a couple extra runs if he was kept in against the Astros. His managerial style is based on making decisions that often feel wrong but, on average, work out better than just instinct. Overall, the strategy works, *and there's no perfect way of predicting when it won't*.

I still lean on this being a bad decision *given the match-up that he was taken out for*, but people are over-reacting so much. Cash brought us to a world series with a roster much worse than other teams at this level.  This sucks, but the odds of winning a world series game with just one run are far lower than the odds of Snell keeping the shut-out for much longer.",2020-10-28,['401246392'],TB
"It did, I would be crying if I was a Rays fan rn, I honestly want to as well",2020-10-27,[],TB
Fireable offense,2020-10-27,[],TB
"Hey fellow flappy bois from the past, it did cost us the game. 2020 is rough.",2020-10-28,['401246392'],TB
"Obvious game-losing consequences aside, I feel like we got robbed of the chance to see a really classic complete game shutout in this WS.   


Not even close to being a guaranteed thing if Snell stays in, but we got robbed of the chance of seeing some magic. Instead Dodgers win thanks to boneheaded moves by their opponents.",2020-10-28,['401246392'],TB
I don't care that he got us this far. This is a fireable offense.,2020-10-27,[],TB
Gotta score more than 1 run against their bullpen day. That's worst than pulling snell.,2020-10-27,[],TB
"While this may be true, you're not going to win many games scoring just 1 run...",2020-10-28,['401246392'],TB
"Analytics is fine when applied in aggregate over a 162 game season. But when you're down to one particular game, guess what? You don't get an average outcome. You get one particular outcome. You can't use aggregate data to make that decision. 

He was dealin' and feelin'. You leave him in, at least until he gives up two in a row or something. And you don't put in Anderson who's been a run-scoring machine. 

You also don't let Adames bat as your last hope and watch him strike out looking.",2020-10-28,['401246392'],TB
No one wants to talk about how terrible this offense was. That's what we need to build on.,2020-10-28,['401246392'],TB
Might have!? What do you mean MIGHT have?,2020-10-27,[],TB
I’ve been saying that this whole time!! Me &amp; my family are so upset about that!,2020-10-27,[],TB
The worst managing move in all sports history...,2020-10-28,['401246392'],TB
"He's worse than Dave Roberts, when removing pitchers. One of the Dodgers was having a no hitter and Roberts removed him",2020-10-28,['401246392'],TB
"I work at Buffalo Wild Wings and while I was cleaning tables I was watching the clinic Snell was putting on. And I remember saying to myself in about the 3rd inning:

""Cash better not take him out, or it's gonna be a very bad night for them.""

I fear that I cursed you all, and I apologize.",2020-10-28,['401246392'],TB
"There was a time where I thought win or lose this series, Tampa would become an extremely attractive options for FAs. But at this point I wouldn’t be surprised if no one wanted to play for this moron and Snell asks for a trade",2020-10-28,['401246392'],TB
How demoralizing it must be as a player to realize your manager is an absolute dumbass. My heart breaks for me and for them.,2020-10-27,[],TB
Cash should be canned for that. Truly stupid.,2020-10-28,['401246392'],TB
You can't wait till Snell gives up a run to pull him the way our offense has played. Snell hasn't pitched more than 6 innings in over a year and that's not because Cash pulled him too soon. The bullpen got us to this point and Cash trusted them and I don't really blame him. If you wanted Snell to stay in the game you should blame the offense for not giving him more of a cushion.,2020-10-28,['401246392'],TB
"Fuck Kevin Cash, that piece of shit.",2020-10-27,[],TB
[deleted comment from heat of moment because of way too intense passion of baseball],2020-10-27,[],TB
"Well, as a minor consolation, at least the excuses and justifications will be fun to read.",2020-10-28,['401246392'],TB
Lol you guys lost cause of a pitcher switch.,2020-10-27,[],TB
Gtfo with your trash grammar,2020-10-27,[],TB
"Analytics, man.  We’re all slaves to “science” in 2020.  Human judgement is soooo 2018.",2020-10-28,['401246392'],TB
"Don’t think it was Cash that made the call judging by his post game interview, though he’s the fall guy. It is, what it is.",2020-10-28,['401246392'],TB
,2017-08-01,['370731118'],TB
No way he tries for second if it wasn't for the cycle haha love it!,2017-08-01,['370731118'],TB
WHAT A NIGHT FOR EVAN LONGORIA. FRANCHISE LEADER IN RUNS AND HITS FOR THE SECOND CYCLE IN TEAM HISTORY. I AM SO EXCITED. ,2017-08-01,['370731118'],TB
FACE OF THE FRANCHISE BOYS,2017-08-01,['370731118'],TB
I really hope this man can put together another run like he had earlier in his career. I want him to be the first Rays exclusive to reach the hall..,2017-08-01,['370731118'],TB
"Congrats Longo, you earned it ",2017-08-01,['370731118'],TB
UPVOTE THE THREAD!!!,2017-08-01,['370731118'],TB
HELL THATS MY FLAPPY BOY!!!! NEEDED THIS ONE REALLY BAD!,2017-08-01,['370731118'],TB
THIS MAN NEEDS A RING,2017-08-01,['370731118'],TB
THAT'S MY HALL OF FAMER,2017-08-01,['370731118'],TB
[MRW ](https://media1.giphy.com/media/e4rNcOFD7YPlK/200w.gif),2017-08-02,['370801118'],TB
"#BEST RAY EVER. MOVE OVER CARL CRAWFORD, I BELIEVE YOU'RE SITTING ON SOMEONE'S THRONE!",2017-08-01,['370731118'],TB
Longo!,2017-08-01,['370731118'],TB
"ily Longo, prob my personal favorite player ever",2017-08-02,['370801118'],TB
 #CYCL3,2017-08-02,['370801118'],TB
UP FLAPS FOR ALL THE BOIS,2017-08-02,['370801118'],TB
This means the Rays are now 2-1 up in terms of cycles/cycles agaisnt. Suddenly this matters to me a great deal. ,2017-08-02,['370801118'],TB
[Watch the Throne!](http://mlb.mlb.com/assets/images/7/1/4/230995714/cuts/DAHMaSsXsAAolWr_9tb69n4z_3p8x7z7e.jpg),2017-08-02,['370801118'],TB
"Astros fan here who went to the game last night. Just wanted to say congrats! Once he came up to bat in the 9th I was hoping he'd get the double (just no more runs). 

I have an extra paper printed ticket from the game that I wanted to give to a Rays fan who might collect historical games. Sorry it's not a traditional ticket but it could be cool in a collection I'm sure. If you want it just respond to this and I'll send it your way.",2017-08-02,['370801118'],TB
Woo-hoo!!,2017-08-02,['370801118'],TB
I need to get a Longoria jersey now,2017-08-02,['370801118'],TB
Damn it!  I went to bed early and missed the single and double. ,2017-08-02,['370801118'],TB
,2021-09-01,['401229045'],TB
"With the Giants’ loss tonight to Milwaukee (god bless the Brewers, let’s go braves), the Giants’ record now sits at 84-48, which is the same as ours. Flappy Bois for the win!",2021-09-01,['401229045'],TB
Imagine being 2nd in the AL east 😂😂,2021-09-01,['401229045'],TB
Who else is ready for Flaptober?,2021-09-01,['401229045'],TB
"We have the best team in baseball. 

Amazing. I honestly don't know how, either.",2021-09-01,['401229045'],TB
Yeah!,2021-09-01,['401229045'],TB
We're in the end game now.,2021-09-01,['401229045'],TB
"I'm originally an Astros fan, bet you could guess when I also became a fan of the Rays, buuuut LETS FUCKING GO FLAPPY BOIS.",2021-09-01,['401229045'],TB
We love to see it,2021-09-01,['401229045'],TB
"This man was called up in the middle of the year, and balled out since he came up. And in an ALDS devoid of good offensive performances, Wander had 2 incredibly clutch homers, and was one of the main reasons the last two games even went to extra innings. It says a lot when a rookie is the most clutch player on a team, and I’m glad Wander is a Tampa Bay Ray",2021-10-12,[],TB
"Oh hell yeah, instant legend. Dude's gonna be a central part of our postseason run every year for the next five years, and probably a future HOFer.

I love him and Randy both, we need to build around them.

Only sad thing about Wander is knowing we probably won't pay him enough to stick around for more than 6 years, and it's already sickening to think of the inevitability of his future in pinstripes at some point.",2021-10-12,[],TB
He’s going to be the best player we’ve ever had.,2021-10-12,[],TB
[deleted],2021-10-12,[],TB
"kid showed up, adjusted, played big in big moments. he’s going to be a treat to watch.",2021-10-12,[],TB
superstar. Lock him down,2021-10-12,[],TB
"*He came up in the middle of the year???*

#THIS YEAR?


For a guy who's only played 67 games at the Major League level he's up there playing with the poise of an experienced 27-year-old phenom. Didn't shy away from the spotlight, rose to every occasion, and plays the right way. He, Arozerena, and Lowe are going to pack a serious punch in your lineup and I'm happy for ya'll.",2021-10-12,[],TB
"Wander, meadows, randy, and kk are the only ones who showed up in the playoffs. Luplow did well too",2021-10-12,[],TB
"Enjoy it while it lasts, cause he ain’t getting paid here. The saddest realization every year we continue to get bounced.",2021-10-12,[],TB
He’s amazing. I’m getting his jersey.,2021-10-12,[],TB
We won’t pay him what he’s worth,2021-10-12,[],TB
"He had a look in his eyes after the loss last night. A scary look. The look of ""I'm never letting this happen again."" I think he's talented and he's very driven and could also become a major leader in that clubhouse and will finally be able to legally enjoy the champagne next year.",2021-10-12,[],TB
Looking forward to him terrorizing us for years to come,2021-10-12,[],TB
He’s so much fun to watch.,2021-10-12,[],TB
Definitely. We need to pick up an older player long term to help him develop his talents.,2021-10-12,[],TB
"He understood the assignment, unlike someone who’s name starts with ‘Bra’ and ends with ‘ndon’",2021-10-12,[],TB
Gonna be awesome to see him leave to another team.,2021-10-12,[],TB
"Well, in a few years, Wander Franco(insert other team name)..",2021-10-13,[],TB
Montreal Ray*,2021-10-12,[],TB
he literally had a historic season,2021-10-12,[],TB
He’s a hall of famer. Best player we will ever have and it sucks because either way we don’t get to keep him for long. Lets enjoy the ride and win as much as we can while he/we are still in St Pete.,2021-10-12,[],TB
"Seemed like every game he was breaking or setting new records. The Rays I know will never pay him what he deserves. Hell, it’s hard to admit but the way this team was playing post season, we don’t even fucking deserve Franco.",2021-10-13,[],TB
,2020-12-27,[],TB
I have never seriously spoken bad about anybody but this man makes my blood boil. I can't believe the MLB lets someone who clearly does not value the team and doesn't even bother to hide it continue to own a team. At some point this bad look needs to be way more publicised so that he becomes a national laughing stock maybe then they'll force him out for PR reasons.,2020-12-28,[],TB
This should be top all time,2020-12-28,[],TB
"I second that. Great prospects... but we were 2 wins away from a World Series. We don’t need prospects, we need established players like Snell and Charlie",2020-12-28,[],TB
Mods can you pin this?,2020-12-28,[],TB
Agreed,2020-12-28,[],TB
Fuck that motherfucker Stu,2020-12-28,[],TB
"Fuck you Stu. Hope you see this, eat a dick you absolute worthless sack of shit",2020-12-28,[],TB
"Vinik is philanthropy Jesus

Glazers are chaotic neutral

Sternberg is the easily hatable cheapskate old white fuck ala Mr. Burns",2020-12-28,[],TB
I honestly can't wait for the day he sells the team....,2020-12-28,[],TB
Always and forevermore.,2020-12-28,[],TB
"Lol, it's even more hilarious knowing the circumstances that lead this team to the World Series.

Sell the team, Stu.",2020-12-28,[],TB
Fuck $tu,2020-12-28,[],TB
Fuck Stu,2020-12-28,[],TB
"Honestly after being so close to winning in the WS this move doesnt make sense now. I get the return being good but the team should have tried to have another go with the core and see what the results were. 

This move seems like its purely for cost savings. MLB and the owners took a hit in revenue because of the shortened season and also not having fans at the games. I feel like $tu decided to cut spending to offset the losses from last year.",2020-12-28,[],TB
We won a trade and y’all mad,2020-12-28,[],TB
"It was a great deal, great prospects that will be under team control a long time, plus a little wiggle room payroll wise.",2020-12-28,[],TB
"I'm seriously thinking about never going to a game again, this was just too much after being 2 games from winning the WS.",2020-12-28,[],TB
Fuck $tu,2020-12-28,[],TB
FUCK STU,2020-12-28,[],TB
"Just a Yankees fan coming in here. I know our fanbases hate each other, and I always root against you guys as well. 

But the amount of owners that are straight up not spending is absolutely becoming an issue. So many people have constantly asked if baseball can work in Florida, but the MLB is actively sabotaging themselves in the state by allowing Stu and owners like Loria to stay for so long. There is no longevity and many casual fans just find it hard to ever root for any long time player",2020-12-28,[],TB
"5 IP 1ER 9K 3H 

Great performance for him having to battle in almost every count!",2019-10-07,['401169083'],TB
Charlie Fucking Morton,2019-10-07,['401169083'],TB
[deleted],2019-10-07,['401169083'],TB
Guys... That might’ve been the best rays game of all time. The energy was unreal!!!,2019-10-07,['401169083'],TB
Big dick Morton. Clutch AF.,2019-10-07,['401169083'],TB
That line. Oakland says wtf deja vu,2019-10-07,['401169083'],TB
"""MR ELIMINATION""",2019-10-07,['401169083'],TB
You're Goddamn right.,2019-10-07,['401169083'],TB
You love to see it!,2021-07-13,[],TB
"""Next time don't forget to ask if I want to be in the home run derby"" - Mike Zunino",2021-07-13,[],TB
I think that’s his first oppo bomb all year,2021-07-13,[],TB
Should have been at the Home Run Derby,2021-07-13,[],TB
It was great to see the big smile that Zunibomb put on Cash's face.,2021-07-13,[],TB
AL MVP,2021-07-13,[],TB
I wish I could upvote this times a million.,2021-07-13,[],TB
3 Rays on the field JFB!,2021-07-13,[],TB
We're going multiples tonite! Z will get another AB.,2021-07-13,[],TB
Yeeeeees,2021-07-13,[],TB
"Zuni with the solo, Wendle with the single. Rays are 2 for 3 with 1 RBI.",2021-07-13,[],TB
JFB all-star material!,2021-07-13,[],TB
Z is taking over this game.,2021-07-13,[],TB
Vote this man for mvp,2021-07-13,[],TB
Not a fan on that comment in the moment from Buck about his BA being under 200,2021-07-14,[],TB
They did it!!! Now let's keep the steam rolling into the playoffs and win the World Series Rays Up!!!!,2020-09-26,['401226554'],TB
Blue Jays up first then. Let’s get it,2020-09-26,['401226554'],TB
Shit yeah.,2020-09-26,['401226554'],TB
[deleted],2020-09-27,['401226569'],TB
flap flap motherfuckers,2020-09-26,['401226554'],TB
Now lets get 40 wins,2020-09-26,['401226554'],TB
Any announcement on when Game 1 will be?  Tuesday?  Wednesday?,2020-09-26,['401226554'],TB
"Fuck Boston. 

Go Braves.",2021-10-22,[],TB
Good. Eat Shit Boston,2021-10-23,[],TB
Their luck ran out,2021-10-23,[],TB
They looked like they didn't belong the last three games,2021-10-23,[],TB
Felt dirty rooting for the astros but dang does it feel good to see boston be absolute garbage the last few games,2021-10-23,[],TB
"Fuck Boston. Their heads were getting way too big. Come back down to Earth, they had an above average team that got hot at the right time then folded like paper.",2021-10-23,[],TB
mehh haven't been watching but i was hoping both would lose than the rays would be crowned the ALCS winner,2021-10-23,[],TB
Good. Now eat popcorn with the rest of us.,2021-10-22,[],TB
Those fuckers,2021-10-23,[],TB
