text,date,time
![gif](giphy|l4EoPk1lohVe46lj2|downsized),2025-04-02,13:46
"LFG love this taking a gamble on a guy who looks like he could be a stud, just like rafaela",2025-04-02,13:47
"Fuck yes, this is what we need",2025-04-02,13:49
![gif](giphy|2RGhmKXcl0ViM),2025-04-02,13:49
Stats was onto something yesterday,2025-04-02,13:51
Doing a hell of a job!,2025-04-02,13:52
What a deal. Don’t get it from Campbell’s end but I’m not complaining,2025-04-02,13:52
"About time that old man Henry awoken from his grave with all this spending, looks like I’ll finally get back to Fenway this summer",2025-04-02,13:53
Dope. Mayer and Anthony next.,2025-04-02,13:58
So are we the braves now,2025-04-02,13:59
"This is a steal, for the Sox!",2025-04-02,14:03
I'd called Mayer and Anothony's agents right now and offer the same 10/100 deal. $10 million AAV for each of those guys in 7 years will be a steal and I think there's a stronger than not chance one of them is literally a $30 million caliber player in 7 or 8 years.,2025-04-02,14:05
Future so bright need 😎,2025-04-02,14:05
"WE’RE SO BACK!! 

The rep trying to sell me season tickets might just get a phone call tonight ;)",2025-04-02,14:06
I am so unbelievably happy about this. I hope the Sox use the off day and the signings to come into tonight pumped.,2025-04-02,14:18
Some in the Boston Media. Blah blah blah. Cannot please everyone. CC has got to show me. Don't tell me. Blah blah blah.,2025-04-02,14:18
"Let's fucking GO. I don't even care how much it is, it's a steal",2025-04-02,14:19
Fuck. Yes.,2025-04-02,14:22
i certainly wouldn’t not give craig below a blowjob right now,2025-04-02,14:23
that'll be a steal if he keeps hitting like he has the first few games,2025-04-02,14:23
The John Henry and Robert Kraft redemption arc needs to be studied,2025-04-02,14:24
![gif](giphy|ftXmTBgSnsJ8c),2025-04-02,14:25
"Wow, awesome news!",2025-04-02,14:33
Fuck yea!,2025-04-02,14:34
"Who are you and what have you done with the owners of the last 5-7 years?

  
Holy shit yes.",2025-04-02,14:42
FULL THROTTLE BITCHES!,2025-04-02,14:44
"Despite the shaky start to this season, the future of this team looks really, really exciting.",2025-04-02,14:45
LFG,2025-04-02,14:53
Cleveland Brown voice “Aaaaand boom goes the dynamite”🧨 💦,2025-04-02,14:57
Wow 🤯,2025-04-02,14:58
Do me next!,2025-04-02,14:59
"I was in the minority and saying we shouldn’t do an extension unless it was going to clearly be a good deal for the team. 

Holy shit this seems like a great deal for the team. Huge upside. I think everyone should be super excited about this",2025-04-02,15:11
What’s the money?,2025-04-02,15:42
John Henry sure likes signing them young. The Crochet contract is the perfect pitching contract for Henry as it covers yrs 26-31.,2025-04-02,17:11
"I’m in. But he’s played 5 games, Crochet less than 300 career innings pitched. Rafaela, Bello — similar. These way before market contracts are starting to look like an over reaction to the Mookie situation. I don’t hate the approach, but I still hope they are willing to give a superstar a top of the market long term deal. We have the money.",2025-04-02,17:15
A good signing. Worth every penny.,2025-04-02,17:39
Well.......that didn't take long!,2025-04-02,17:59
THIS IS THE WAY,2025-04-02,18:12
Ok but what if he’s Bobby D?,2025-04-02,22:22
Even Trevor Story is hitting!!,2025-04-05,07:07
"BACK 2 BACK EXTENSIONS, WE EATING FOR THE NEXT DECADE",2025-04-02,13:45
Is John Henry back?,2025-04-02,13:48
What an idiot,2025-04-02,16:07
Red sox are ruining baseball!!! Wooo!!!!,2025-04-02,13:44
This man just dared a man with 50 pounds on him to rush the mound and absolutely destroyed him when he did. Retire the number 56 right fucking now. Red Sox legend.,2018-04-11,22:44
"Joe Kelly: ""Come on!""

Red Sox nation has your back.",2018-04-11,23:34
"Straight 🔥🔥🔥, you see him in the after game interview? “...it’s a cold night and one got away from me...” but his eyes we’re saying “i’ll throw at that fuck again!”",2018-04-12,00:04
The whole thing could have been avoided if Austin would've been ejected as per MLB rules. Football and hockey have enforcers. MLB has pitchers. You wanna spike our 2baseman at full stride buckle up buttercup....,2018-04-12,02:41
"Dat fella has balls. Always stand up for your teammates. I know it's frowned upon by pretty much everyone, but Kelly took that risk to stand up for Holt. Sometimes the rules are wrong and sometimes people should fight back. Kelly was fearless. I don't always agree with hitting batters, but as Sale said last year ""I'm not going to lose any sleep over it."" ",2018-04-12,00:20
Joe Kelly for fucking president,2018-04-11,23:26
Then Austin punches the wrong guy because he is a Fuck boi moron. ,2018-04-11,22:45
"I changed my number to his,

respect to /u/cy_kelly for prophetically seeing how much of a G this man is.  CY KELLY!!!",2018-04-12,01:04
Next time we need Vazquez stepping up and shoving Austin to really spark up the classic brawl,2018-04-11,23:43
"All these bitch ass Yankee fans telling me Kelly didn't win the fight, lmao",2018-04-12,00:10
"Days like this even though we kicked ass, i wish we we had Gabe Kapler and Nixon. They were big fucking g's.",2018-04-12,04:56
"I missed the game because it's fucking impossible to watch in Europe, but I'm rocking a new flair for the time being",2018-04-12,05:31
u/cykelly your alter\-ego is now fire. ,2018-04-11,23:50
"Tyler Austin is a lil bitch that got sat down by the LEAST intimidating pitcher in baseball. That being said, any human alive would be stupid to challenge Arron Judge",2018-04-12,00:12
Joe Kelly will continue to be my favorite player for life. Bravo ,2018-04-12,01:13
Joe Kelly gained so many respect points for that... Tyler Austin is gigantic pussy,2018-04-12,02:02
"Did dis dude just didn't Dat

Joe fucking Kelly is the first guy we have bequeathed fucking as a middle name to in ages that I have a sense of pride about

A part of me thinks Vazquez should have been quicker or uppercutted Austin in the dick from behind and prevented him from getting to Kelly, but Joe fucking Kelly wanted that shit ",2018-04-11,23:39
Buying his jersey TODAY.,2018-04-12,07:49
Can't wait to see how Torre fucks these suspensions up. ,2018-04-12,08:22
Austin really is a meat head. ,2018-04-12,00:19
[Told you.](https://www.reddit.com/r/redsox/comments/8aft0p/the_yankees_lose_in_extras/dwydu7g/),2018-04-11,23:29
He chalked that boy the fuck out!!,2018-04-12,08:26
I hope Joe Kelly and Marcus Morris become best friends ,2018-04-12,08:45
I've liked Joe Kelly ever since he pitched against the us when he as with the Cards in the 2013 WS. He's the man,2018-04-12,12:42
"That little hand flick like ""yea I know."" Props to both of those guys just wanting to fight, this is so good for the rivalry.",2018-04-12,07:12
"Dude realized the one way to go from 0 to hero in an instant was to fight a Yankees player

So he did",2018-04-12,09:16
"I said it yesterday before all of this in that Kelly using the Walmart kid yodel as his warm up song, Joe Kelly is a national fucking treasure.",2018-04-12,08:31
"Joe ""Ground and Pound"" Kelly",2018-04-12,10:04
Never thought id see this many salty Yankee fans after a win,2018-04-12,11:11
Fuck Joe torre and his lame suspensions,2018-04-12,18:00
"Rivalry is alive and well!  We needed this. 

",2018-04-12,10:02
I've literally watched this fight on repeat.,2018-04-12,09:05
"I come in peace, but let’s be real with ourselves. This was a stupid fight to begin with. Although if Austin got “destroyed” can someone show me a gif of Kelly actually landing a punch?

",2018-04-12,07:16
"Am I the only Sox fan who has no problem with the slide but also has a problem with hitting a batter intentionally?

Don't get me wrong, this is fun to watch no matter the ethics. But if i'm a Yankees fan i'm justifiably mad.",2018-04-12,08:05
[removed],2018-04-12,07:49
Hahaha you sound a little butt hurt my man. You triggered so you had to comment on the thread? Are you mad at joe Kelly punking the yanks or are you really mad because you realized the sox going to win the al East by over ten games? ,2018-04-12,11:42
October when the sox clinch by ten plus games? That garbage pitching staff ain't getting you anywhere. ,2018-04-12,11:54
"Besides the cleating it was a late slide right at his back leg.
Top 5 Red Sox pitchers you would expect to throw at someone in retaliation:
5. Heath Hembree - Would be higher if he still looked like kenny powers
4. Erod - Threw at Machado, little more tame than throwing at his head
3. Chris Sale - Those jerseys didn't cut themselves, he dgaf if he's the best player
2. Matt Barnes - Threw at Machado's head, bit of over kill
1. Joe F'in Kelly - You can't great about him coming into a tie game, but you know he's gonna throw at someone if he has to

Dead Last: David Price, [unless he is throwing against the red sox](https://www.si.com/mlb/strike-zone/2014/05/31/red-sox-rays-david-ortiz-david-price-ejections)",2018-04-12,11:30
I'm not sure I find it more amusing or pathetic that you can't see I was clearly joking about throwing old guys 😭,2018-04-12,11:49
[deleted],2018-04-12,00:14
[deleted],2018-04-12,00:19
Lol and then was manhandled by judge ,2018-04-12,15:05
[removed],2018-04-11,22:51
"5 IP, 2 H, 1 R. 

Right after Sale goes 1 IP giving up 5 runs. 4 perfect innings from Houck right after that shit. Motherfucker just turned in a 2018 Eovaldi-esque performance and changed the entire feel of the game. He doesn’t do that ***we lose***. 

I don’t care that we scored 14 runs, if he gives up another 3-4 and struggles through a few innings the whole dynamic of the game is different. We literally had Matt Barnes warming up in the 1st inning to relieve Sale if he couldn’t get 3 outs.

Houck saved our season. He’s a god damn hero.",2021-10-08,22:54
9 and 1/3rd innings of perfect ball down the stretch in some HUGE games.  14 Ks.  11 innings 14 ks 1 run.,2021-10-08,23:15
He was amazing! Can't wait to see him every fifth day next year!,2021-10-08,23:07
"That was the most important performance of his career. He shifted the momentum of the game entirely. He's only 25 and pitching in his first playoff run, but you would think hes a vet who's already been here before",2021-10-08,23:17
Get to see our other hero pitch next. Life is good atm,2021-10-08,23:06
Tanner really has really taken his game to the next level the past couple weeks.  Ace of the future.,2021-10-08,23:14
Tanner Houck is my boyfriend now,2021-10-08,23:10
Yup.  That effort was Wakefieldian in its excellence.  Almost as good as Pedro vs. the Indians in '99.,2021-10-08,23:31
Gimme a Houck yeah!!!,2021-10-09,00:01
"Well said, my friend.",2021-10-08,23:02
"“we just saved the season, what does that make us?”

“BIG DAMN HEROES SIR”",2021-10-08,23:38
"Yes. At least sale is still available if needed for some reason, unlike Wacha Wacha",2021-10-08,23:14
Str8 fax,2021-10-08,23:09
I love this guy so much. Cool land luke destroys RHH. He will be straight elite if he works on something to get lefties out reliably. Still depending on a lot of soft contact against them.,2021-10-08,23:41
Captain Houck,2021-10-08,23:10
Where were you when Tanner Houck fixed the bullpen?,2021-10-09,07:58
And his face literally never changed once. You know Eck and DOB would have been calling him Cool-Hand Luke all outing. Epic performance. Clutch Tanner is a different beast.,2021-10-09,12:02
"Eck nicknaming him ""cool hand Luke"" has never been more apt.

Terrific performance.",2021-10-09,13:47
#Tanner Houckules.,2021-10-09,00:27
HOUCK YEAH,2021-10-09,00:00
Would you give Sale’s rotation spot to Houck if the post season goes that far?,2021-10-08,23:20
"Could you say the Red Sox took a much needed hit off the Houck-ah Pipe? (yes, I know that's not how you say his name, but the pun just hit me when I saw it)",2021-10-09,01:35
"I'm just going to say this - ""literally"" has become the new verbal tic that needs to go away.

People use it for emphasis, but not only is that not the proper use of the word, it has gotten overused.

God bless and fuck the Rays, Yankees and hell lets throw Leafs fans right under that bus, too.",2021-10-09,10:57
"You literally used the word ""literally"" twice in 5 sentences.... give literally a rest.",2021-10-09,09:33
Tanner Houck to start game five?   I’m in!,2021-10-09,08:35
Houck is the man. Fuck Chris Sale until he can redeem himself.,2021-10-08,23:12
i thought barnes was off the postseason rosteri,2021-10-09,00:58
"so if jd doesnt hit a three run homer what houck does is moot.  oh wait, its a team game?  hmm, weird isnt it.",2021-10-09,11:18
Stop saying Houck is reverse Sale. Houckamania is on his own,2021-10-09,14:32
Houck a loogie in my mouth,2021-10-09,19:52
,2022-07-01,17:27
"My account was named after tzu-wei lin, that way it lives in immortality",2022-07-01,17:29
"Lmao, needed this, thank you u/HanselRoblesEnjoyer",2022-07-01,17:59
I love how the mods pinned this to the front page,2022-07-01,18:00
"If i bought gold, id gold this post",2022-07-01,18:47
I think you'll just have to start frequenting r/IndependentBaseball soon,2022-07-01,18:01
Permently delete this account and message mods and have them pen your newaccount name so we know its you,2022-07-01,17:59
"Lolol. 

But seriously. DFA Robles.",2022-07-01,18:07
"&gt;redditor for 1 month

lol...",2022-07-01,18:16
The game ruined my day but this made me smile,2022-07-01,18:16
One of my old GameFAQS usernames back in the day was EricGagneIsGood,2022-07-01,18:20
"This easily made up for todays game, funniest shit ice seen in a while lol, I was wondering why this question was pinned",2022-07-01,19:23
Hansel… so cold right now,2022-07-01,19:43
"As a Mets fan, I feel like I can safely say WE WARNED YOU ALL!!",2022-07-01,19:58
Nope. But I didn’t want to change mine anyway :),2022-07-01,18:41
Lol,2022-07-01,17:55
Love the username bro,2022-07-01,18:09
"This reminds me of when Bill Simmons had a kid in 2007 and was thinking of naming him Beckett.  He dropped the idea when someone pointed out that, if he'd had the kid in the late 80s, he would have named him after Roger Clemens.",2022-07-01,20:26
LOL,2022-07-01,19:20
"Well, at least here we know u/HanselRoblesEnjoyer does not enjoy Hansel Robles with that spiffy new flair from the mods!",2022-07-01,20:35
username checks out.,2022-07-01,17:47
Amazing.,2022-07-01,19:42
"I believe the only ones available are ""IPunchMyOwnDick"" and ""YankeeFanboiFromBoston"" so.... good luck with that",2022-07-01,20:04
"Bro, I’ve been bitching about Robles in here all week, thank you for this",2022-07-01,19:42
Just change your flair to a yankees flair and it will make sense again.,2022-07-01,19:02
Post of the day here!,2022-07-01,20:53
[](/#surprise2) lol,2022-07-02,02:59
I will buy gold for anyone who can answer this riddle. Bonus is you know where these words were written.,2022-07-01,21:57
increasingly relevant,2022-07-01,22:03
r/usernamechecksout,2022-07-01,22:53
[deleted],2022-07-01,17:29
Nope. U stick with it,2022-07-02,07:20
"I thought mine was bad, made on a whim after an episode of Law &amp; Order: SVU. One of the corniest lines uttered by a character.

Yours takes the cake, I feel for you.",2022-07-02,07:54
Uninstall the ap and reinstall and start over,2022-07-02,08:40
Deal with it. Learn from what you’ve created. You were doomed from the beginning.,2022-07-02,09:40
,2022-08-16,22:03
Still not as bad as that 4 game losing streak.,2022-08-16,22:25
October: Yankees blow 3-0 series lead for first time in 18 years.,2022-08-16,23:16
Yankme are toast...,2022-08-16,22:15
it's what you want,2022-08-17,00:21
"I mean, the Sox are doing shit but, nice.",2022-08-16,23:09
Good. Fuck 'em.,2022-08-16,22:40
Whisper those sweet words to me some more.,2022-08-16,23:58
It’s not what you want?,2022-08-16,22:28
"Boone’s totally fucked, right? Unless they pull a World Series off?",2022-08-17,01:57
Have been shut out 9 times &amp; no hit once( 15 innings straight I believe),2022-08-16,22:57
#YOU HATE TO SEE IT!,2022-08-16,23:24
"They were playing over their heads earlier in the season. This is just them coming back to earth. No way that roster adds up to a .700 ballclub. 

But I don't really concern myself with the Yankees. I had no idea they had lost five series in a row until I saw this. I care if the Red Sox win or not, and if they win, everything takes care of itself.",2022-08-16,23:10
All the first half Yankee bandwagoners can thankfully go back to not giving a shit about them anymore.,2022-08-17,00:31
"In nyc right now, told the waiter wearing a Yanks hat that ever since they traded Joey gallo they’ve been 👎 😜",2022-08-17,11:47
"I saw a video of  Rizzo hitting with the bases loaded and hitting into a bunch of fielders choices and 4-6-3's. Wish it was DJ LeMahieu, I'd have made the awesome joke FC LeMahieu",2022-08-17,00:52
This pleases me,2022-08-17,01:16
And we helped fuel this streak!,2022-08-17,09:33
"They’re still on track for 100 wins but thankfully aren’t headed for a record.  It’s hard to get excited, though.  They’re likely going to win the Division and we’re lucky to get a WC.

At this point, they aren’t likely to match the 108 win ‘18 Sox, though, so there’s that.",2022-08-17,01:34
let’s go tampa!,2022-08-16,23:11
The frustrating thing is this actually hurts our cause to move up in the standings. Not saying we should root for them but them losing right now isn't great timing for us either.,2022-08-17,08:04
Red Sox are below .500 and 6 other teams are in front of them for a wild card slot.,2022-08-17,06:39
should we care about this if the Sox don't make the playoffs?,2022-08-17,01:01
I mean I hate to say it but don’t we want them to win to help us get this WC spot ?,2022-08-17,04:17
"They’re hurting. No Luis Severino, Mike king, Stanton, Chad Green, Matt Carpenter, Luis Gil, and Clay Holmes. Now they know how the Sox feel.",2022-08-17,09:42
DAAAAAAAAAAAAA JANKEES LOOSE!!!!!!,2022-08-17,11:23
God bless,2022-08-16,22:59
"I don't honestly care. They are in the playoffs, we are not right now, that's all that matters. In fact it's in our best interest for the Yankees to win as they are facing the Rays who we are chasing.",2022-08-17,04:14
"Wake up babe, daily Yankees L just dropped",2022-08-17,10:36
That’s wonderful! Now all that the Stankees need to do is get an L10 of 0-10 and then we’ll all be happy!,2022-08-17,10:45
Lol they're turning into us 11 years ago.,2022-08-17,11:06
Wrong sub.,2022-08-17,12:10
"Stawp, stawp! My penis can only get so erect",2022-08-17,13:02
I heard somewhere that they suck. Is that true?,2022-08-17,14:44
This is the top-rated post here?  Fucking pathetic.,2022-08-17,15:21
Who cares?!  This post is sad,2022-08-17,16:43
"I like Aaron Judge as a singular player, so I'm sad he probably won't get 60 homers, but I hate the yankees more so I'm happy to see them fail",2022-08-17,17:09
https://tenor.com/bzuDI.gif,2022-08-17,17:34
You love to see it,2022-08-17,17:46
You wanna know why? Cause the Yankees SUCK.,2022-08-17,19:33
wouldn’t it be something if they outright dominated the first half of the season just to collapse in the second half? I hate to bring this up but it’s almost worse than 2011. Probably is worse tbh,2022-08-17,20:30
#DAAAAAAAAAAAAAA JANKEES LOSE!,2018-09-20,23:12
"Enjoy Oakland, you miserable fucks.",2018-09-20,23:14
God im glad it ended with Stanton striking out. https://m.youtube.com/watch?v=of1bVlo_5Y4,2018-09-20,23:15
"Imagine hitting a grandslam, and losing .",2018-09-21,08:45
Daaaa jankees lose,2018-09-21,07:40
SAY IT AGAIN!!! 👂 ,2018-09-21,00:53
Louder for the people in the back!!,2018-09-21,07:58
Me and the boys. ,2018-09-21,07:34
Fuck the Yankees and Fuck the Jets! ,2018-09-21,10:42
I'm going to be hard for days. ,2018-09-21,09:56
You know what else I thoroughly enjoyed? Allllllllll the Yankee fans ran for the exit when chappy served it up to M(VP)ookie Betts ,2018-09-21,11:06
"Fuck da Jankees!!!! 

This is only the beginning!!! Bring on da postseason!!",2018-09-21,11:01
RULE 3 AND FUCK THE JETS,2018-09-21,12:46
F,2018-09-21,02:54
"Always great to beat the team from NY for​ the division. Now, they are more jealous of us than we were of them.",2018-09-21,11:23
https://www.youtube.com/watch?v=zk-2_Z9bRds :D,2018-09-21,12:23
There were a lot of Cora doubters. Gotdayum tho! ,2018-09-21,23:23
,2018-09-24,22:19
I want the 11 wins in October. ,2018-09-24,22:23
"And with that, we have clinched home-field advantage through out the postseason as well!",2018-09-24,22:29
GIMME THE GOLD,2018-09-24,22:24
"I’ll admit it, I had no faith this team would win the East over the Yanks, let alone break a franchise record. I love this team so much for proving me wrong, let’s go boys!",2018-09-24,23:38
I really did have a good feeling that tonight was gonna be the night after we won!!,2018-09-24,22:25
IS THAT GOOD?!?!?!!?,2018-09-24,23:02
Now let's just make sure we make it an odd number of victories.,2018-09-24,22:21
Very impressive.  Congrats!,2018-09-25,08:33
I can honestly say that this team with 106 wins is a lot better than the one with only 105. ,2018-09-25,08:49
"Watching this team all year makes me wonder what it was like to watch the 2001 Mariners.  Like, think about how insanely good we've been all year so far. *IF* we win all the rest of our games, those Mariners would still be what, 5 games better?  That must have been insane to watch.",2018-09-25,11:48
I hate the O’s.,2018-09-24,22:36
Where's the preseason copypasta?,2018-09-25,01:41
"Great season for the Red Sox, and I hope everyone enjoys it. It could end in the divisional series, and I think people would classify it as a waste. I don't see it that way, I truly think this has been one of the best years of baseball, and when it's the playoffs all it takes is one team to get hot to get it going, you hope it's the Sox but for crying out loud the AL is brutal, The Astros will have 100 wins, the Indians improved after the deadline (granted their division is Helen Keller drunk), The Yankees could reach 100, the Athletics are the same and the Rays are at 90 wins! Appreciate this season, and understand bad things happen to good teams, because of our past history I don't trust our pitching but Cora seems to be laid back. Edit\*\* Cora seems to be laid back where it doesn't put any pressure on his team, and they truly understand the game by game dynamic. ",2018-09-25,08:12
This team is stacked,2018-09-24,22:26
"Way to go boys, nice news to wake up to.",2018-09-25,01:42
Its been a great season...one of the funnest seasons I can remember....its ironic to me that the one game I did go to this year was one in which the offense was shut down by a barley average pitcher in Mike Leake and didn't get score a run until the 9th inning against the Mariners closer....,2018-09-25,10:02
If they don't win the WS who cares?,2018-09-25,14:37
"My favorite line from that game?  Eck going ""that's when chin music was......chin music.""",2018-09-25,20:37
Now let's get 11 more in October!,2018-09-24,23:18
"Hell of a season guys, congratulations!",2018-09-25,12:47
"remember when it was supposed to be 118 games though.. i cant help but feel we peaked at the wrong damn time, yet again.",2018-09-24,22:35
"Been seeing some Sox 'fans' over in r/baseball licking Machado's taint and trying to say he didn't end Pedroia's career.

First off, fuck you and your fake ass.

Second, turn in your jerseys and flair and get the fuck outta here. Don't let the subreddit door hit you in the ass on the way out. (I don't actually possess authority in this but it's how I'm fuckin feelin)

Third, fuck the Yankees.

Fourth, fuck you again. Just for good measure.",2021-09-19,13:04
I still rewatch the video of Chris sale striking out manny to win the World Series at least once a month. Greatest day ever.,2021-09-19,14:31
Maybe fuck the Yankees again one more time. Just for good measure. Seems like we could all use it about now.,2021-09-19,14:01
I had someone with a sox flair send me a gif implying that they believed David Ortiz did steroids. So safe to safe I think there's just a lot of bad actors on that subreddit. ALSO FUCK MANNY MACHADO,2021-09-19,15:11
Machado hands down ended Pedroias career. Anyone who disagrees didn’t watch the replay in slow mo where his leg goes from 0 to 45 degrees from 2nd base to his knee.,2021-09-19,15:18
"Just because he's ""grown as a person"" or whatever doesn't mean he shouldn't be held responsible for the actions he did when he was an immature dick.

Fuck Manny Machado.",2021-09-19,13:51
"Machado in the 2018 WS
4-22 with 5 K   All 4 hits were singles. 

In 115 postseason AB in his  BA is .200.  23 hits and 28 Ks.  6 XB hits and 44 TB.   

My personal fav was game 5 when Sox finished LA off. Machado went 0-4 with 3 Ks the infamous K against Sale when he looked a drunk guy in men’s softball.  It was poetic justice.  A guy couldn’t of given up more blatantly after they went down 0-2.

Edit:  felt wrong writing Manny and talking negative so had to change it to strictly last name.  Saying the name Manny always remind me of the man, the myth, the legend- Manny Ramirez

God we were lucky to see Manny, Ortiz, Pedro play together.   What a fun time in Boston.  I wish I was a tad bit older to really appreciate it.  Not sure there will ever we such an iconic team, on and off the field, as that 04 team.",2021-09-19,17:13
[deleted],2021-09-19,13:10
It's always Fuck Manny Machado Season.,2021-09-19,13:48
"wtf red sox fan is defending machado?  fuck that shithole.

i mean no let's be reasonable, i don't wish him real harm.  but small, kind-of-funny-stub-your-toe-type harm?  yea give that shit to him in spades and send me the footage.",2021-09-19,14:02
Machado can suck it,2021-09-19,13:29
Fuck Machado.,2021-09-19,15:08
